"author","authorIsChannelOwner","cid","comment","commentsCount","hasCreatorHeart","pageUrl","publishedTimeText","replyCount","replyToCid","title","type","videoId","voteCount"
"@NanangMrk","true","Ugwz3FqDFIgevEnVUaN4AaABAg","#INDONESIA DARURAT MEMBACA!!!!! 

STARLINK INI ADALAH LAYANAN INTERNET SATELIT BROADBAND sebagaimana layanan Broadband pada umumnya yang dirancang  untuk penggunaan pribadi JIKA ANDA GUNAKAN SEBAGAI ISP RT RW NET / Voucheran  dan terdeteksi terdapat trafik yang berlebian STARLINK akan sangat mudah memblokir Akun Anda (alat ini lebih canggih daripada yang saya duga ) . dan terminal STARLINK tanpa Akun hanyalah sebuah sampah para bola yang tidak berguna , MAKA JANGAN MENCOBA MEMPERKAYA DIRI SENDIRI DAN MENGAMBIL KEUNTUNGAN DENGAN CARA-CARA yang tidak semestinya :)
STARLINK INI DIRANCANG UNTUK DAERAH DENGAN INFRASTRUKTUR INTERNET RENDAH AGAR BISA MENIKMATI INTERNET LAYAK DENGAN HARGA TERJANGKAU , MARI MENJADI MANUSIA YANG BIJAK DAN BEAKHLAK
I LOVE YOU SEMUA , SALAM NanangMrk 😘","4843","false","https://www.youtube.com/watch?v=U-ZyepruMh0","5 months ago (edited)","419",,"STARLINK INDONESIA REVIEW, INTERNET DARI LANGIT TANPA SINYAL DIMANAPUN ANDA BERADA (TERLENGKAP)","comment","U-ZyepruMh0","1200"
"@irunchannel4470","false","UgzBVrEwAdbhkIEUbNV4AaABAg","Berpa hrga Starlink yg bisa di pake buat bisnis voucheran bang🙏","4843","false","https://www.youtube.com/watch?v=U-ZyepruMh0","9 hours ago","0",,"STARLINK INDONESIA REVIEW, INTERNET DARI LANGIT TANPA SINYAL DIMANAPUN ANDA BERADA (TERLENGKAP)","comment","U-ZyepruMh0","0"
"@NengsihKilla","false","UgyxoIms8o0z-pTf8Ap4AaABAg","Kira kira berapa unit HP yang bisa konek ke dihubungkan kerouter","4843","false","https://www.youtube.com/watch?v=U-ZyepruMh0","4 days ago","0",,"STARLINK INDONESIA REVIEW, INTERNET DARI LANGIT TANPA SINYAL DIMANAPUN ANDA BERADA (TERLENGKAP)","comment","U-ZyepruMh0","0"
"@AbuDardaTrans","false","UgyROC0ERlOYUFAGsyB4AaABAg","Jarak maksimal berapa jauh mas signalnya","4843","false","https://www.youtube.com/watch?v=U-ZyepruMh0","4 days ago","0",,"STARLINK INDONESIA REVIEW, INTERNET DARI LANGIT TANPA SINYAL DIMANAPUN ANDA BERADA (TERLENGKAP)","comment","U-ZyepruMh0","0"
"@YahyaArsyady","false","UgwCo-M_CmWHcZm0xxR4AaABAg","Hrga brpa 1 unitnya starlink yg lg d demo tu ?","4843","false","https://www.youtube.com/watch?v=U-ZyepruMh0","9 days ago","0",,"STARLINK INDONESIA REVIEW, INTERNET DARI LANGIT TANPA SINYAL DIMANAPUN ANDA BERADA (TERLENGKAP)","comment","U-ZyepruMh0","0"
"@Ahmadkholil-b2j","false","Ugwur0apSUkopFCN6tZ4AaABAg","indonesia unlimited berbatas kuota... maling legal dgn aturan.... :face-blue-smiling::face-blue-smiling:tapi di luar negeri kalau unlimited sebulan ya sepuas nya...","4843","false","https://www.youtube.com/watch?v=U-ZyepruMh0","11 days ago","0",,"STARLINK INDONESIA REVIEW, INTERNET DARI LANGIT TANPA SINYAL DIMANAPUN ANDA BERADA (TERLENGKAP)","comment","U-ZyepruMh0","0"
"@KOMEDI_TIKTOK","false","Ugx3reJtxbc988W57PN4AaABAg","Bang apa bisa cod ke papua","4843","false","https://www.youtube.com/watch?v=U-ZyepruMh0","2 weeks ago","0",,"STARLINK INDONESIA REVIEW, INTERNET DARI LANGIT TANPA SINYAL DIMANAPUN ANDA BERADA (TERLENGKAP)","comment","U-ZyepruMh0","0"
"@dt.syafrani4895","false","UgyxRzSQ6TftvpUueRR4AaABAg","Bang.. Minta nope nya bang.. Saya dari kalimantan utara","4843","false","https://www.youtube.com/watch?v=U-ZyepruMh0","2 weeks ago","0",,"STARLINK INDONESIA REVIEW, INTERNET DARI LANGIT TANPA SINYAL DIMANAPUN ANDA BERADA (TERLENGKAP)","comment","U-ZyepruMh0","0"
"@azzamaulana2669","false","UgyIlkS6nPoHdrJbicB4AaABAg","Ni barang nya yg d jual online apa ka ori semua, maksud  tda ada d jual yg palsu?","4843","false","https://www.youtube.com/watch?v=U-ZyepruMh0","2 weeks ago","0",,"STARLINK INDONESIA REVIEW, INTERNET DARI LANGIT TANPA SINYAL DIMANAPUN ANDA BERADA (TERLENGKAP)","comment","U-ZyepruMh0","0"
"@Yusri-m8o","false","UgwXeKD5q796GeW9wSV4AaABAg","Bang maw tnya apakah starling saat daftar blh si pendaftar berada di profinsi yg berbeda dengan starlingnya?","4843","false","https://www.youtube.com/watch?v=U-ZyepruMh0","3 weeks ago","0",,"STARLINK INDONESIA REVIEW, INTERNET DARI LANGIT TANPA SINYAL DIMANAPUN ANDA BERADA (TERLENGKAP)","comment","U-ZyepruMh0","0"
"@ayuningtyas2891","false","UgwimhPUZ7HfYCiaEkF4AaABAg","Starlink dengan kuota termurah berapa lur","4843","false","https://www.youtube.com/watch?v=U-ZyepruMh0","3 weeks ago","0",,"STARLINK INDONESIA REVIEW, INTERNET DARI LANGIT TANPA SINYAL DIMANAPUN ANDA BERADA (TERLENGKAP)","comment","U-ZyepruMh0","0"
"@SayaDar","false","UgzoJcxrsosjgEZiI3p4AaABAg","Berarti ga bisa buat wifi voucheran ya kak","4843","false","https://www.youtube.com/watch?v=U-ZyepruMh0","3 weeks ago","0",,"STARLINK INDONESIA REVIEW, INTERNET DARI LANGIT TANPA SINYAL DIMANAPUN ANDA BERADA (TERLENGKAP)","comment","U-ZyepruMh0","0"
"@rfproductionbyl2024","false","UgyoMsbwbLcI0K8yKK54AaABAg","Kalo dari starlink di repeat menggunakan router untuk memperluas jangkauan wifi apa bisa bangg?","4843","false","https://www.youtube.com/watch?v=U-ZyepruMh0","3 weeks ago","0",,"STARLINK INDONESIA REVIEW, INTERNET DARI LANGIT TANPA SINYAL DIMANAPUN ANDA BERADA (TERLENGKAP)","comment","U-ZyepruMh0","0"
"@nursalamjamarudin4532","false","UgwonnXx9R4yemXhR1t4AaABAg","Cara pesannya bagaimana kak?","4843","false","https://www.youtube.com/watch?v=U-ZyepruMh0","3 weeks ago","0",,"STARLINK INDONESIA REVIEW, INTERNET DARI LANGIT TANPA SINYAL DIMANAPUN ANDA BERADA (TERLENGKAP)","comment","U-ZyepruMh0","0"
"@louisnicholas4174","false","Ugzn9AX2kM_CCmfl8HB4AaABAg","Kok aku ngak bisa ngescan langitnya?","4843","false","https://www.youtube.com/watch?v=U-ZyepruMh0","1 month ago","0",,"STARLINK INDONESIA REVIEW, INTERNET DARI LANGIT TANPA SINYAL DIMANAPUN ANDA BERADA (TERLENGKAP)","comment","U-ZyepruMh0","0"
"@ERISINFO","false","UgxYSHvf88F3MJrgVr14AaABAg","Harga berapa yah","4843","false","https://www.youtube.com/watch?v=U-ZyepruMh0","1 month ago","0",,"STARLINK INDONESIA REVIEW, INTERNET DARI LANGIT TANPA SINYAL DIMANAPUN ANDA BERADA (TERLENGKAP)","comment","U-ZyepruMh0","0"
"@johanhutagaol6186","false","UgzI3AOVhvgIwHxz_g94AaABAg","Ini ditarok di dalam rumah atau di atas genteng bang?, terus kalau kena Hujan gimana?, petir juga jadi lawan kalau di tarok di atas rumah kan?","4843","false","https://www.youtube.com/watch?v=U-ZyepruMh0","1 month ago","0",,"STARLINK INDONESIA REVIEW, INTERNET DARI LANGIT TANPA SINYAL DIMANAPUN ANDA BERADA (TERLENGKAP)","comment","U-ZyepruMh0","0"
"@ITKOMP","false","UgwTQOn6GCDsQLhn2E94AaABAg","mantap infonya #xky   maju terus","4843","false","https://www.youtube.com/watch?v=U-ZyepruMh0","1 month ago","0",,"STARLINK INDONESIA REVIEW, INTERNET DARI LANGIT TANPA SINYAL DIMANAPUN ANDA BERADA (TERLENGKAP)","comment","U-ZyepruMh0","0"
"@riyanfadhol8937","false","UgwYRigzOgTDTswPtuJ4AaABAg","Mas bisa gak sih pakek wifi pemancar?","4843","false","https://www.youtube.com/watch?v=U-ZyepruMh0","1 month ago","0",,"STARLINK INDONESIA REVIEW, INTERNET DARI LANGIT TANPA SINYAL DIMANAPUN ANDA BERADA (TERLENGKAP)","comment","U-ZyepruMh0","0"
"@alvianchoiriapriliansyah9882","false","UgxP2bx_3SdmF0-YFkN4AaABAg","Ujug-ujugnya toh siapa juga yang luncurin satelit Kacific & salah satu satelit Telkom (4), Satria-1, dan Nusantara Satu?

Betul, jawabannya adalah SpaceX Falcon 9 wkwk","4843","false","https://www.youtube.com/watch?v=U-ZyepruMh0","1 month ago (edited)","0",,"STARLINK INDONESIA REVIEW, INTERNET DARI LANGIT TANPA SINYAL DIMANAPUN ANDA BERADA (TERLENGKAP)","comment","U-ZyepruMh0","0"
"@garudaup","false","Ugwz3FqDFIgevEnVUaN4AaABAg.A3Iaocx4XY6A3IbEBYxiI0","😍 ;😍","4843","true","https://www.youtube.com/watch?v=U-ZyepruMh0","5 months ago","0","Ugwz3FqDFIgevEnVUaN4AaABAg","STARLINK INDONESIA REVIEW, INTERNET DARI LANGIT TANPA SINYAL DIMANAPUN ANDA BERADA (TERLENGKAP)","reply","U-ZyepruMh0","11"
"@pojoklawang5599","false","Ugwz3FqDFIgevEnVUaN4AaABAg.A3Iaocx4XY6A3IbgXd5pYn","Mas...nak dalam beberapa hari / minggu / bulan kedepan ada rencana mau dijual kabar2 nggeh..😔","4843","false","https://www.youtube.com/watch?v=U-ZyepruMh0","5 months ago","0","Ugwz3FqDFIgevEnVUaN4AaABAg","STARLINK INDONESIA REVIEW, INTERNET DARI LANGIT TANPA SINYAL DIMANAPUN ANDA BERADA (TERLENGKAP)","reply","U-ZyepruMh0","21"
"@NanangMrk","true","Ugwz3FqDFIgevEnVUaN4AaABAg.A3Iaocx4XY6A3IcRwhFfTf","​ @pojoklawang5599 okei syap","4843","false","https://www.youtube.com/watch?v=U-ZyepruMh0","5 months ago","0","Ugwz3FqDFIgevEnVUaN4AaABAg","STARLINK INDONESIA REVIEW, INTERNET DARI LANGIT TANPA SINYAL DIMANAPUN ANDA BERADA (TERLENGKAP)","reply","U-ZyepruMh0","22"
"@Andalankita9uys","false","Ugwz3FqDFIgevEnVUaN4AaABAg.A3Iaocx4XY6A3IclrhcNqP","Mantap ilmunya dibagi biar semua pada tahu ❤","4843","true","https://www.youtube.com/watch?v=U-ZyepruMh0","5 months ago","0","Ugwz3FqDFIgevEnVUaN4AaABAg","STARLINK INDONESIA REVIEW, INTERNET DARI LANGIT TANPA SINYAL DIMANAPUN ANDA BERADA (TERLENGKAP)","reply","U-ZyepruMh0","14"
"@KangItan","false","Ugwz3FqDFIgevEnVUaN4AaABAg.A3Iaocx4XY6A3Icnqw9ALw","dikirain starlink bisa buat dijadiin isp rt rw net ❤❤❤","4843","true","https://www.youtube.com/watch?v=U-ZyepruMh0","5 months ago","0","Ugwz3FqDFIgevEnVUaN4AaABAg","STARLINK INDONESIA REVIEW, INTERNET DARI LANGIT TANPA SINYAL DIMANAPUN ANDA BERADA (TERLENGKAP)","reply","U-ZyepruMh0","33"
"@gradienstudio2714","false","Ugwz3FqDFIgevEnVUaN4AaABAg.A3Iaocx4XY6A3IdYMJfTbN","Tetep lah pokonya RT/RW net paling canggih.. 😁😍","4843","false","https://www.youtube.com/watch?v=U-ZyepruMh0","5 months ago","0","Ugwz3FqDFIgevEnVUaN4AaABAg","STARLINK INDONESIA REVIEW, INTERNET DARI LANGIT TANPA SINYAL DIMANAPUN ANDA BERADA (TERLENGKAP)","reply","U-ZyepruMh0","19"
"@UluhLewu","false","Ugwz3FqDFIgevEnVUaN4AaABAg.A3Iaocx4XY6A3Idxa_jedc","berapa device yang bisa terhubung jaringan mas?","4843","false","https://www.youtube.com/watch?v=U-ZyepruMh0","5 months ago","0","Ugwz3FqDFIgevEnVUaN4AaABAg","STARLINK INDONESIA REVIEW, INTERNET DARI LANGIT TANPA SINYAL DIMANAPUN ANDA BERADA (TERLENGKAP)","reply","U-ZyepruMh0","19"
"@starking2214","false","Ugwz3FqDFIgevEnVUaN4AaABAg.A3Iaocx4XY6A3Ie0qtoi4x","Bang cobain buat rt rw net selama 3 bulan, apakah terblokir 😂","4843","false","https://www.youtube.com/watch?v=U-ZyepruMh0","5 months ago","0","Ugwz3FqDFIgevEnVUaN4AaABAg","STARLINK INDONESIA REVIEW, INTERNET DARI LANGIT TANPA SINYAL DIMANAPUN ANDA BERADA (TERLENGKAP)","reply","U-ZyepruMh0","30"
"@Rachellvi","false","Ugwz3FqDFIgevEnVUaN4AaABAg.A3Iaocx4XY6A3If2xJEVjQ","RT RW NET pake starlink bisa aja terutama di desa terpencil intinya jgn sampe ketahuan atau di lapor ken.. untuk contoh starlink ke mikrotik ada di Chanel luar. starlink tidak langsung memblokir jika terjadi trafik berlebih.. ia akan mengurangi kecepatan.. jarang terjadi kasus pemblokiran justru yang banyak terjadi kehilangan akun karena serangan hacker... isu Nigeria di blok karena RT RW NET benar adanya cuman tidak seluruh warga Nigeria di blok hanya segelintir RT RW net disana yang di lapor kan yang akhirnya di blacklist .. justru tindakan yg dilakukan  STARLINK mengatasi hal tersebut malah menurunkan harga bulanan lebih murah lagi khusus Nigeria agar terjangkau dan merata .... gw cuman berbagi info broo.  pada akhirnya keputusan dan tanggung wajab kembali ke kita masing2 Lebih mulia memperkaya diri sendiri melalui usaha RT RW net menurutku daripada korupsi anggaran BTS","4843","false","https://www.youtube.com/watch?v=U-ZyepruMh0","5 months ago (edited)","0","Ugwz3FqDFIgevEnVUaN4AaABAg","STARLINK INDONESIA REVIEW, INTERNET DARI LANGIT TANPA SINYAL DIMANAPUN ANDA BERADA (TERLENGKAP)","reply","U-ZyepruMh0","28"
"@ARGaming-90","false","Ugwz3FqDFIgevEnVUaN4AaABAg.A3Iaocx4XY6A3IfDaqML0U","Apa iya paket residensial harus langganan 1 tahun?","4843","false","https://www.youtube.com/watch?v=U-ZyepruMh0","5 months ago","0","Ugwz3FqDFIgevEnVUaN4AaABAg","STARLINK INDONESIA REVIEW, INTERNET DARI LANGIT TANPA SINYAL DIMANAPUN ANDA BERADA (TERLENGKAP)","reply","U-ZyepruMh0","5"
"@NanangMrk","true","Ugwz3FqDFIgevEnVUaN4AaABAg.A3Iaocx4XY6A3IflbIY2Ec","Cobain sendiri aja saya ngga mau​ @starking2214 ","4843","false","https://www.youtube.com/watch?v=U-ZyepruMh0","5 months ago","0","Ugwz3FqDFIgevEnVUaN4AaABAg","STARLINK INDONESIA REVIEW, INTERNET DARI LANGIT TANPA SINYAL DIMANAPUN ANDA BERADA (TERLENGKAP)","reply","U-ZyepruMh0","11"
"@NanangMrk","true","Ugwz3FqDFIgevEnVUaN4AaABAg.A3Iaocx4XY6A3IfnaIu3qH","​ @Rachellvi kata siapa boleh?","4843","false","https://www.youtube.com/watch?v=U-ZyepruMh0","5 months ago","0","Ugwz3FqDFIgevEnVUaN4AaABAg","STARLINK INDONESIA REVIEW, INTERNET DARI LANGIT TANPA SINYAL DIMANAPUN ANDA BERADA (TERLENGKAP)","reply","U-ZyepruMh0","4"
"@kanghafidzzz","false","Ugwz3FqDFIgevEnVUaN4AaABAg.A3Iaocx4XY6A3Ig6aibubT","Oh brarti starlink juga broadband ya mas","4843","false","https://www.youtube.com/watch?v=U-ZyepruMh0","5 months ago","0","Ugwz3FqDFIgevEnVUaN4AaABAg","STARLINK INDONESIA REVIEW, INTERNET DARI LANGIT TANPA SINYAL DIMANAPUN ANDA BERADA (TERLENGKAP)","reply","U-ZyepruMh0","1"
"@yohanesden9018","false","Ugwz3FqDFIgevEnVUaN4AaABAg.A3Iaocx4XY6A3IhNG2w4rm","mas Nanang.. apa kh paket starlink ini bisa di buat wifi Voucheran? agar bisa jualan internet wifi di kampung..","4843","false","https://www.youtube.com/watch?v=U-ZyepruMh0","5 months ago","0","Ugwz3FqDFIgevEnVUaN4AaABAg","STARLINK INDONESIA REVIEW, INTERNET DARI LANGIT TANPA SINYAL DIMANAPUN ANDA BERADA (TERLENGKAP)","reply","U-ZyepruMh0","8"
"@juzcomment","false","Ugwz3FqDFIgevEnVUaN4AaABAg.A3Iaocx4XY6A3Ii4mB5G8d"," @yohanesden9018  UDA DIJELASIN PAKE HURUF KAPITAL GITU MASIH NANYA KY GINI???","4843","false","https://www.youtube.com/watch?v=U-ZyepruMh0","5 months ago","0","Ugwz3FqDFIgevEnVUaN4AaABAg","STARLINK INDONESIA REVIEW, INTERNET DARI LANGIT TANPA SINYAL DIMANAPUN ANDA BERADA (TERLENGKAP)","reply","U-ZyepruMh0","0"
"@jonikorwa8418","false","Ugwz3FqDFIgevEnVUaN4AaABAg.A3Iaocx4XY6A3IilLSIYRh","Mas,misal di perluas pke repeater hnya untuk mnbah jangkauan bbrpa rmah dr rmah utama gt aman gak ya?jd kasusnya bukan untuk djual intrnet rt rw net,tp tmpat usaha brjarak bbrpaa rmah ddr rmah utama yg mw dpsang starlink. Misal di tmpat usaha gak smpe sinyal wifi nya trus dpke kan repeater apakah aman maas?mohon infonya. Mslahnya hrga alat nya ra main2,trus prkara mw dpke sndri hnya beda lokasi trus di blokir kan ra lucu.😂😂😂","4843","false","https://www.youtube.com/watch?v=U-ZyepruMh0","5 months ago","0","Ugwz3FqDFIgevEnVUaN4AaABAg","STARLINK INDONESIA REVIEW, INTERNET DARI LANGIT TANPA SINYAL DIMANAPUN ANDA BERADA (TERLENGKAP)","reply","U-ZyepruMh0","3"
"@NanangMrk","true","Ugwz3FqDFIgevEnVUaN4AaABAg.A3Iaocx4XY6A3IisFlGrkJ","​ @yohanesden9018 Indonesia darurat Membaca","4843","false","https://www.youtube.com/watch?v=U-ZyepruMh0","5 months ago","0","Ugwz3FqDFIgevEnVUaN4AaABAg","STARLINK INDONESIA REVIEW, INTERNET DARI LANGIT TANPA SINYAL DIMANAPUN ANDA BERADA (TERLENGKAP)","reply","U-ZyepruMh0","64"
"@Renngur","false","Ugwz3FqDFIgevEnVUaN4AaABAg.A3Iaocx4XY6A3IjNKA25cD"," @NanangMrk sy udh coba pesan dari minggu lalu namun pada saat klik perbarui alamat pengiriman malah gak bisa lanjut pembayaran selalu muncul “ ada yang tidak beres di pihak kami, harap tunggu lalu coba lagi “ apakah ada solusi","4843","false","https://www.youtube.com/watch?v=U-ZyepruMh0","5 months ago","0","Ugwz3FqDFIgevEnVUaN4AaABAg","STARLINK INDONESIA REVIEW, INTERNET DARI LANGIT TANPA SINYAL DIMANAPUN ANDA BERADA (TERLENGKAP)","reply","U-ZyepruMh0","5"
"@MARUYUNK_69","false","Ugwz3FqDFIgevEnVUaN4AaABAg.A3Iaocx4XY6A3IjPnmpThp","Setelah Saya baca ini, Sya 100% mundur ga jadi Beli untuk Memperkaya diri sendiri dan Menggunakan ISP lama untuk Menghidupi RT RW net Saya. . .😅😅😅😅","4843","false","https://www.youtube.com/watch?v=U-ZyepruMh0","5 months ago","0","Ugwz3FqDFIgevEnVUaN4AaABAg","STARLINK INDONESIA REVIEW, INTERNET DARI LANGIT TANPA SINYAL DIMANAPUN ANDA BERADA (TERLENGKAP)","reply","U-ZyepruMh0","29"
"@adamsobari3746","false","Ugwz3FqDFIgevEnVUaN4AaABAg.A3Iaocx4XY6A3Ikxg-4v05","1:11","4843","false","https://www.youtube.com/watch?v=U-ZyepruMh0","5 months ago","0","Ugwz3FqDFIgevEnVUaN4AaABAg","STARLINK INDONESIA REVIEW, INTERNET DARI LANGIT TANPA SINYAL DIMANAPUN ANDA BERADA (TERLENGKAP)","reply","U-ZyepruMh0","11"
"@gositakupas9407","false","Ugwz3FqDFIgevEnVUaN4AaABAg.A3Iaocx4XY6A3Il6_If7VO","Pake yg bisnis bisa gk bosss","4843","false","https://www.youtube.com/watch?v=U-ZyepruMh0","5 months ago","0","Ugwz3FqDFIgevEnVUaN4AaABAg","STARLINK INDONESIA REVIEW, INTERNET DARI LANGIT TANPA SINYAL DIMANAPUN ANDA BERADA (TERLENGKAP)","reply","U-ZyepruMh0","1"
"@arwaniwahab","false","Ugwz3FqDFIgevEnVUaN4AaABAg.A3Iaocx4XY6A3IlA0e9OEC","​ @MARUYUNK_69 😂😂😂","4843","false","https://www.youtube.com/watch?v=U-ZyepruMh0","5 months ago","0","Ugwz3FqDFIgevEnVUaN4AaABAg","STARLINK INDONESIA REVIEW, INTERNET DARI LANGIT TANPA SINYAL DIMANAPUN ANDA BERADA (TERLENGKAP)","reply","U-ZyepruMh0","0"
"@apriyono6864","false","Ugwz3FqDFIgevEnVUaN4AaABAg.A3Iaocx4XY6A3IlTKYz1PS","​ @Renngur  sedang ada gangguan emang bg di bagian check out nya,gw mau beli adaptor ethernet nya juga gak bisa pas pembayaran nya","4843","false","https://www.youtube.com/watch?v=U-ZyepruMh0","5 months ago","0","Ugwz3FqDFIgevEnVUaN4AaABAg","STARLINK INDONESIA REVIEW, INTERNET DARI LANGIT TANPA SINYAL DIMANAPUN ANDA BERADA (TERLENGKAP)","reply","U-ZyepruMh0","0"
"@mustafiin4081","false","Ugwz3FqDFIgevEnVUaN4AaABAg.A3Iaocx4XY6A3Ilwr7dlY8","Yang pakai saya balas di video sampean iki toh mas nanag pakai jaringan starlink.... 

Buka semua di hp tanpa lola","4843","false","https://www.youtube.com/watch?v=U-ZyepruMh0","5 months ago","0","Ugwz3FqDFIgevEnVUaN4AaABAg","STARLINK INDONESIA REVIEW, INTERNET DARI LANGIT TANPA SINYAL DIMANAPUN ANDA BERADA (TERLENGKAP)","reply","U-ZyepruMh0","3"
"@wongsugih8666","false","Ugwz3FqDFIgevEnVUaN4AaABAg.A3Iaocx4XY6A3InnVnPcoi","@NanangMrk sunat po ugung kang","4843","false","https://www.youtube.com/watch?v=U-ZyepruMh0","5 months ago","0","Ugwz3FqDFIgevEnVUaN4AaABAg","STARLINK INDONESIA REVIEW, INTERNET DARI LANGIT TANPA SINYAL DIMANAPUN ANDA BERADA (TERLENGKAP)","reply","U-ZyepruMh0","3"
"@faizalljewell4809","false","Ugwz3FqDFIgevEnVUaN4AaABAg.A3Iaocx4XY6A3Io2u9HA61","Kalau akun terbelokir apakah bisa buat lagi? Orang Indonesia banyak akalnya... Lama2 STARLINK jadi RT/RW Net... Wkwkwkwk 🤣🤣","4843","false","https://www.youtube.com/watch?v=U-ZyepruMh0","5 months ago","0","Ugwz3FqDFIgevEnVUaN4AaABAg","STARLINK INDONESIA REVIEW, INTERNET DARI LANGIT TANPA SINYAL DIMANAPUN ANDA BERADA (TERLENGKAP)","reply","U-ZyepruMh0","22"
"@mustafiin4081","false","Ugwz3FqDFIgevEnVUaN4AaABAg.A3Iaocx4XY6A3IoL6ijF3G","@yohanesden9018 bisa om. Saya sendiri langganan beli voucher bulanan sama yg punya starlink","4843","false","https://www.youtube.com/watch?v=U-ZyepruMh0","5 months ago","0","Ugwz3FqDFIgevEnVUaN4AaABAg","STARLINK INDONESIA REVIEW, INTERNET DARI LANGIT TANPA SINYAL DIMANAPUN ANDA BERADA (TERLENGKAP)","reply","U-ZyepruMh0","0"
"@wasistosgp485","false","Ugwz3FqDFIgevEnVUaN4AaABAg.A3Iaocx4XY6A3IoemOZH1p","Mas, wifi nya bsa di share barcode gk? 
Atau bisa di Hotspot kan lg gk? 
Klo bisa sih mmang gk bsa buat jualan 😂","4843","false","https://www.youtube.com/watch?v=U-ZyepruMh0","5 months ago","0","Ugwz3FqDFIgevEnVUaN4AaABAg","STARLINK INDONESIA REVIEW, INTERNET DARI LANGIT TANPA SINYAL DIMANAPUN ANDA BERADA (TERLENGKAP)","reply","U-ZyepruMh0","3"
"@jprast007","false","Ugwz3FqDFIgevEnVUaN4AaABAg.A3Iaocx4XY6A3Iqnubg-lX","​ @ARGaming-90 iya, sepertinya ga harus langganan 1 tahun. Sama aja sama yg jelajah cm ga bs kemana2","4843","false","https://www.youtube.com/watch?v=U-ZyepruMh0","5 months ago","0","Ugwz3FqDFIgevEnVUaN4AaABAg","STARLINK INDONESIA REVIEW, INTERNET DARI LANGIT TANPA SINYAL DIMANAPUN ANDA BERADA (TERLENGKAP)","reply","U-ZyepruMh0","0"
"@Kentelnet123","false","Ugwz3FqDFIgevEnVUaN4AaABAg.A3Iaocx4XY6A3Ir7MRNiiS","​ @NanangMrk  mungkin mereka malas membaca artikel pentingnya mas😂","4843","false","https://www.youtube.com/watch?v=U-ZyepruMh0","5 months ago","0","Ugwz3FqDFIgevEnVUaN4AaABAg","STARLINK INDONESIA REVIEW, INTERNET DARI LANGIT TANPA SINYAL DIMANAPUN ANDA BERADA (TERLENGKAP)","reply","U-ZyepruMh0","0"
"@achmadfatoni5909","false","Ugwz3FqDFIgevEnVUaN4AaABAg.A3Iaocx4XY6A3IrG3STSfl","Klo buat satu komplek boleh ngak tuh Bang?","4843","false","https://www.youtube.com/watch?v=U-ZyepruMh0","5 months ago","0","Ugwz3FqDFIgevEnVUaN4AaABAg","STARLINK INDONESIA REVIEW, INTERNET DARI LANGIT TANPA SINYAL DIMANAPUN ANDA BERADA (TERLENGKAP)","reply","U-ZyepruMh0","1"
"@NanangMrk","true","Ugwz3FqDFIgevEnVUaN4AaABAg.A3Iaocx4XY6A3IrIdgJAD6","Buat = beli lagi​ @faizalljewell4809 ","4843","false","https://www.youtube.com/watch?v=U-ZyepruMh0","5 months ago","0","Ugwz3FqDFIgevEnVUaN4AaABAg","STARLINK INDONESIA REVIEW, INTERNET DARI LANGIT TANPA SINYAL DIMANAPUN ANDA BERADA (TERLENGKAP)","reply","U-ZyepruMh0","6"
"@BryanRZa","false","Ugwz3FqDFIgevEnVUaN4AaABAg.A3Iaocx4XY6A3IrQLNeX5T","​ @faizalljewell4809 5:25 penjelasan bayar dulu baru dapet akun","4843","false","https://www.youtube.com/watch?v=U-ZyepruMh0","5 months ago","0","Ugwz3FqDFIgevEnVUaN4AaABAg","STARLINK INDONESIA REVIEW, INTERNET DARI LANGIT TANPA SINYAL DIMANAPUN ANDA BERADA (TERLENGKAP)","reply","U-ZyepruMh0","0"
"@muhammaddodi2755","false","Ugwz3FqDFIgevEnVUaN4AaABAg.A3Iaocx4XY6A3IsRXuucdy","Untuk paket nya apakah bisa di ganti2, misalnya 3 bulan residensial selanjutnya  untuk 3 bulan berikutnya paket jelajah??","4843","false","https://www.youtube.com/watch?v=U-ZyepruMh0","5 months ago","0","Ugwz3FqDFIgevEnVUaN4AaABAg","STARLINK INDONESIA REVIEW, INTERNET DARI LANGIT TANPA SINYAL DIMANAPUN ANDA BERADA (TERLENGKAP)","reply","U-ZyepruMh0","1"
"@faizalljewell4809","false","Ugwz3FqDFIgevEnVUaN4AaABAg.A3Iaocx4XY6A3IsoFOQEN7"," @NanangMrk  yasalam.... Sukses terus mas... Terimakasih banyak informasi nya... 😁🙏","4843","true","https://www.youtube.com/watch?v=U-ZyepruMh0","5 months ago","0","Ugwz3FqDFIgevEnVUaN4AaABAg","STARLINK INDONESIA REVIEW, INTERNET DARI LANGIT TANPA SINYAL DIMANAPUN ANDA BERADA (TERLENGKAP)","reply","U-ZyepruMh0","0"
"@Tiexo01","false","Ugwz3FqDFIgevEnVUaN4AaABAg.A3Iaocx4XY6A3IuO-vjo40","kalau di VPN mas ?","4843","false","https://www.youtube.com/watch?v=U-ZyepruMh0","5 months ago","0","Ugwz3FqDFIgevEnVUaN4AaABAg","STARLINK INDONESIA REVIEW, INTERNET DARI LANGIT TANPA SINYAL DIMANAPUN ANDA BERADA (TERLENGKAP)","reply","U-ZyepruMh0","3"
"@sopironline123","false","Ugwz3FqDFIgevEnVUaN4AaABAg.A3Iaocx4XY6A3IuSf7XagL","apaklah bisa di ptp?","4843","false","https://www.youtube.com/watch?v=U-ZyepruMh0","5 months ago","0","Ugwz3FqDFIgevEnVUaN4AaABAg","STARLINK INDONESIA REVIEW, INTERNET DARI LANGIT TANPA SINYAL DIMANAPUN ANDA BERADA (TERLENGKAP)","reply","U-ZyepruMh0","0"
"@nicholaschin97","false","Ugwz3FqDFIgevEnVUaN4AaABAg.A3Iaocx4XY6A3Iv0tKTsi_","Makasih infonya, baru mau saya coba hahaha","4843","false","https://www.youtube.com/watch?v=U-ZyepruMh0","5 months ago","0","Ugwz3FqDFIgevEnVUaN4AaABAg","STARLINK INDONESIA REVIEW, INTERNET DARI LANGIT TANPA SINYAL DIMANAPUN ANDA BERADA (TERLENGKAP)","reply","U-ZyepruMh0","0"
"@wongoke2033","false","Ugwz3FqDFIgevEnVUaN4AaABAg.A3Iaocx4XY6A3IvNkxGuYH","Nah itu yang ada dipikiran saya ketika sama orang2 dijual lagi 😂😂","4843","false","https://www.youtube.com/watch?v=U-ZyepruMh0","5 months ago","0","Ugwz3FqDFIgevEnVUaN4AaABAg","STARLINK INDONESIA REVIEW, INTERNET DARI LANGIT TANPA SINYAL DIMANAPUN ANDA BERADA (TERLENGKAP)","reply","U-ZyepruMh0","2"
"@yhusuftbechtel-no4rg","false","Ugwz3FqDFIgevEnVUaN4AaABAg.A3Iaocx4XY6A3IvfyUJSP8","Starlink dari elom musk cocok untuk di pakai di daerah plosok plosok negri karna tidak ada hambatan bangunan tinggi , atau menara transmiter provider lain. kelemahan dari Starlink itu bangunan2 tinggi dan menara provider akan menghambat spectrum gelombang signal. jd cocok banget starlink do area terbuka luas sperti plosok2 desa , ditengah sawah , hutan2 , kebun2 blantara","4843","true","https://www.youtube.com/watch?v=U-ZyepruMh0","5 months ago","0","Ugwz3FqDFIgevEnVUaN4AaABAg","STARLINK INDONESIA REVIEW, INTERNET DARI LANGIT TANPA SINYAL DIMANAPUN ANDA BERADA (TERLENGKAP)","reply","U-ZyepruMh0","17"
"@robedkaltara4199","false","Ugwz3FqDFIgevEnVUaN4AaABAg.A3Iaocx4XY6A3IviDK6jPb","Kang. Coba nanti tes berapa device yang sanggup di hajar sama si starlink nih","4843","false","https://www.youtube.com/watch?v=U-ZyepruMh0","5 months ago","0","Ugwz3FqDFIgevEnVUaN4AaABAg","STARLINK INDONESIA REVIEW, INTERNET DARI LANGIT TANPA SINYAL DIMANAPUN ANDA BERADA (TERLENGKAP)","reply","U-ZyepruMh0","4"
"@robedkaltara4199","false","Ugwz3FqDFIgevEnVUaN4AaABAg.A3Iaocx4XY6A3IvlIN2AZy","Sama bisa kah di bagi2 berapa router.. maaf nanya ya kang","4843","false","https://www.youtube.com/watch?v=U-ZyepruMh0","5 months ago","0","Ugwz3FqDFIgevEnVUaN4AaABAg","STARLINK INDONESIA REVIEW, INTERNET DARI LANGIT TANPA SINYAL DIMANAPUN ANDA BERADA (TERLENGKAP)","reply","U-ZyepruMh0","1"
"@yhusuftbechtel-no4rg","false","Ugwz3FqDFIgevEnVUaN4AaABAg.A3Iaocx4XY6A3IvqtWmf6-","Starlink perbulan nya 800.000 an , cuma kelebihan nya tidak perlu memakai parabola","4843","false","https://www.youtube.com/watch?v=U-ZyepruMh0","5 months ago","0","Ugwz3FqDFIgevEnVUaN4AaABAg","STARLINK INDONESIA REVIEW, INTERNET DARI LANGIT TANPA SINYAL DIMANAPUN ANDA BERADA (TERLENGKAP)","reply","U-ZyepruMh0","1"
"@Legacy999-i8f","false","Ugwz3FqDFIgevEnVUaN4AaABAg.A3Iaocx4XY6A3IwZGE37rr","Mas nanank, untuk aturan dilarang menjual bandwidth kembali apakah tertera juga ya di website atau manual book starlink? 🙏","4843","false","https://www.youtube.com/watch?v=U-ZyepruMh0","5 months ago","0","Ugwz3FqDFIgevEnVUaN4AaABAg","STARLINK INDONESIA REVIEW, INTERNET DARI LANGIT TANPA SINYAL DIMANAPUN ANDA BERADA (TERLENGKAP)","reply","U-ZyepruMh0","4"
