"author","authorIsChannelOwner","cid","comment","commentsCount","hasCreatorHeart","pageUrl","publishedTimeText","replyCount","replyToCid","title","type","videoId","voteCount"
"@sragengamers2837","false","UgyDdpnZWnwHDtrsgQJ4AaABAg","Bakal akan jadi lelet kalo udah banyak yang pakai ini","4843","false","https://www.youtube.com/watch?v=U-ZyepruMh0","4 months ago","0",,"STARLINK INDONESIA REVIEW, INTERNET DARI LANGIT TANPA SINYAL DIMANAPUN ANDA BERADA (TERLENGKAP)","comment","U-ZyepruMh0","0"
"@adityapramudya9909","false","UgyQEvo6i3_C3SDWF7x4AaABAg","Starboy enek ra mas","4843","false","https://www.youtube.com/watch?v=U-ZyepruMh0","4 months ago","0",,"STARLINK INDONESIA REVIEW, INTERNET DARI LANGIT TANPA SINYAL DIMANAPUN ANDA BERADA (TERLENGKAP)","comment","U-ZyepruMh0","0"
"@praguntoroexperience2914","false","UgzThSzZVRm979prdXt4AaABAg","ditunggu untuk review2 starlink selanjut-nya ... markotop mas-E","4843","true","https://www.youtube.com/watch?v=U-ZyepruMh0","4 months ago","0",,"STARLINK INDONESIA REVIEW, INTERNET DARI LANGIT TANPA SINYAL DIMANAPUN ANDA BERADA (TERLENGKAP)","comment","U-ZyepruMh0","5"
"@supriyantopgd7686","false","Ugy4vpPjrYH1s94Q9Zt4AaABAg","Mass @NanangMrk apakah starlink bisa dibikin untuk usaha jualan vocher wifi di daerah saya yg lokasinya berada di atas gunung...","4843","false","https://www.youtube.com/watch?v=U-ZyepruMh0","4 months ago","0",,"STARLINK INDONESIA REVIEW, INTERNET DARI LANGIT TANPA SINYAL DIMANAPUN ANDA BERADA (TERLENGKAP)","comment","U-ZyepruMh0","0"
"@herrykiswanto16","false","UgxlAm_TD3W0gj7oLsh4AaABAg","Ijin tanya bang, powernya bisa pakai Aki DC langsung nggak bang? Karna di daerah 3T ga ada PLN bang 😀 cuma mengandalkan tenaga surya","4843","false","https://www.youtube.com/watch?v=U-ZyepruMh0","4 months ago","0",,"STARLINK INDONESIA REVIEW, INTERNET DARI LANGIT TANPA SINYAL DIMANAPUN ANDA BERADA (TERLENGKAP)","comment","U-ZyepruMh0","0"
"@dedisantoso4227","false","UgyS9Ym9Ft1fbJtU3tZ4AaABAg","Jarak router dan hp max brp meter bang","4843","false","https://www.youtube.com/watch?v=U-ZyepruMh0","4 months ago","0",,"STARLINK INDONESIA REVIEW, INTERNET DARI LANGIT TANPA SINYAL DIMANAPUN ANDA BERADA (TERLENGKAP)","comment","U-ZyepruMh0","0"
"@tomoanthoni","false","UgzjDuuyh8Dz5d9C_QZ4AaABAg","semoga saja setelah di launching resmi di Bali bisa setara dengan harga di Afrika/Nigeria biaya langganan untuk paket standar setara Rp. 450.000 / bulan","4843","false","https://www.youtube.com/watch?v=U-ZyepruMh0","4 months ago","0",,"STARLINK INDONESIA REVIEW, INTERNET DARI LANGIT TANPA SINYAL DIMANAPUN ANDA BERADA (TERLENGKAP)","comment","U-ZyepruMh0","0"
"@renoherdhiansyah3766","false","UgxKduYDFLD-gPUpYTh4AaABAg","Thanks a lot mas reviewnya.. banyak bgt info yg kudapetin 😊","4843","false","https://www.youtube.com/watch?v=U-ZyepruMh0","4 months ago","0",,"STARLINK INDONESIA REVIEW, INTERNET DARI LANGIT TANPA SINYAL DIMANAPUN ANDA BERADA (TERLENGKAP)","comment","U-ZyepruMh0","0"
"@ukuleleofficial1173","false","UgzKVfjn39kU2LjoW3p4AaABAg","Coba setup di atas rumah mas","4843","false","https://www.youtube.com/watch?v=U-ZyepruMh0","4 months ago","0",,"STARLINK INDONESIA REVIEW, INTERNET DARI LANGIT TANPA SINYAL DIMANAPUN ANDA BERADA (TERLENGKAP)","comment","U-ZyepruMh0","0"
"@Uzuka-25","false","UgzWMzMMUsq2VMMUDbJ4AaABAg","masuk ke web starlinknya cari wilayah yg tercover ,cari negara palestina ,gak ada 😢","4843","false","https://www.youtube.com/watch?v=U-ZyepruMh0","4 months ago","0",,"STARLINK INDONESIA REVIEW, INTERNET DARI LANGIT TANPA SINYAL DIMANAPUN ANDA BERADA (TERLENGKAP)","comment","U-ZyepruMh0","0"
"@gss4495","false","Ugx8bKTuy8wU96kZIld4AaABAg","Bahaya juga. Takutnya semua divice di indo bisa di retas dengan mudah karnra terkonek 1 induk ibaratkan kayak komputer induk warnet","4843","false","https://www.youtube.com/watch?v=U-ZyepruMh0","4 months ago","0",,"STARLINK INDONESIA REVIEW, INTERNET DARI LANGIT TANPA SINYAL DIMANAPUN ANDA BERADA (TERLENGKAP)","comment","U-ZyepruMh0","0"
"@Doni_Ardiansyah593","false","Ugyy4_3hQ7NcVN1PafJ4AaABAg","Bang izin tanya kalok yang paket residensial berlangganan di lokasi A trus beberapa hari atau tahun kedepannya ternyata kita pindah rumah yang lumayan jauh jaraknya, apakah bisa di pakek atau kudu beli alat lagi sama registrasi lagi? Mohon di jawab bang.?","4843","false","https://www.youtube.com/watch?v=U-ZyepruMh0","4 months ago","0",,"STARLINK INDONESIA REVIEW, INTERNET DARI LANGIT TANPA SINYAL DIMANAPUN ANDA BERADA (TERLENGKAP)","comment","U-ZyepruMh0","0"
"@tomplojenius9819","false","UgxfYUcc4a45JeOUgLl4AaABAg","pacaran hanya untuk BOCAH 😂🤣","4843","false","https://www.youtube.com/watch?v=U-ZyepruMh0","4 months ago","0",,"STARLINK INDONESIA REVIEW, INTERNET DARI LANGIT TANPA SINYAL DIMANAPUN ANDA BERADA (TERLENGKAP)","comment","U-ZyepruMh0","0"
"@rianrovers774","false","UgyqGGs5sjowykQju4h4AaABAg","Berapa perbulannya perbulan , di tempat saya yg enggak masuk kabel wifi bisa makek juga enggak 🤔","4843","false","https://www.youtube.com/watch?v=U-ZyepruMh0","4 months ago","0",,"STARLINK INDONESIA REVIEW, INTERNET DARI LANGIT TANPA SINYAL DIMANAPUN ANDA BERADA (TERLENGKAP)","comment","U-ZyepruMh0","0"
"@vinjuli37","false","Ugy1BdGqKb2k872y3Z94AaABAg","Abis ini tes alat di daerah susah sinyal , episode ke 3 coba buat router pasaran buat nembak wifi 6 ini ya . Kalo work saya beli karna untuk kebutuhan tetangga .","4843","false","https://www.youtube.com/watch?v=U-ZyepruMh0","4 months ago","0",,"STARLINK INDONESIA REVIEW, INTERNET DARI LANGIT TANPA SINYAL DIMANAPUN ANDA BERADA (TERLENGKAP)","comment","U-ZyepruMh0","0"
"@AjengDewiana-p7r","false","UgyzTWTATSGJAWCMqEJ4AaABAg","Kaya gitu apa ya bayar bulanan atau apa gitu? Apa cuma beli alat, jadi free selama nya","4843","false","https://www.youtube.com/watch?v=U-ZyepruMh0","4 months ago","0",,"STARLINK INDONESIA REVIEW, INTERNET DARI LANGIT TANPA SINYAL DIMANAPUN ANDA BERADA (TERLENGKAP)","comment","U-ZyepruMh0","0"
"@rohmanyuliawan631","false","UgzgGByFU40Pkt3Iuep4AaABAg","Bisa buat pemilu online ni lima tahun mendatang 😁","4843","false","https://www.youtube.com/watch?v=U-ZyepruMh0","4 months ago","0",,"STARLINK INDONESIA REVIEW, INTERNET DARI LANGIT TANPA SINYAL DIMANAPUN ANDA BERADA (TERLENGKAP)","comment","U-ZyepruMh0","0"
"@SitiRohmah-dn9fk","false","UgyK6WL6D-ZeThtnmzx4AaABAg","Di lokasi pegunungan yg sama sekali gak ada jaringan bisa gk","4843","false","https://www.youtube.com/watch?v=U-ZyepruMh0","4 months ago","0",,"STARLINK INDONESIA REVIEW, INTERNET DARI LANGIT TANPA SINYAL DIMANAPUN ANDA BERADA (TERLENGKAP)","comment","U-ZyepruMh0","0"
"@Batu-x6m","false","UgxSNjPgFjiOiFMwWwJ4AaABAg","Beli sih bisa aja, tapi binggung soalnya beli paketan internet nya mahal harus langganan setiap tahun, Tergantung pemakaian.","4843","false","https://www.youtube.com/watch?v=U-ZyepruMh0","4 months ago","0",,"STARLINK INDONESIA REVIEW, INTERNET DARI LANGIT TANPA SINYAL DIMANAPUN ANDA BERADA (TERLENGKAP)","comment","U-ZyepruMh0","0"
"@KrisTianto-hv5kd","false","Ugxnmwysqx2xhfSxgzB4AaABAg","❤❤❤❤ JOS MAS BRO","4843","false","https://www.youtube.com/watch?v=U-ZyepruMh0","4 months ago","0",,"STARLINK INDONESIA REVIEW, INTERNET DARI LANGIT TANPA SINYAL DIMANAPUN ANDA BERADA (TERLENGKAP)","comment","U-ZyepruMh0","1"
"@angelLg-yy6tx","false","Ugz8ZTYlxPgh_FXHmCV4AaABAg","Cobain dong tes main game, cloud Xbox game pass lancar kagak","4843","false","https://www.youtube.com/watch?v=U-ZyepruMh0","4 months ago","0",,"STARLINK INDONESIA REVIEW, INTERNET DARI LANGIT TANPA SINYAL DIMANAPUN ANDA BERADA (TERLENGKAP)","comment","U-ZyepruMh0","0"
"@jipanspeedvlog289","false","Ugzfl4AUtDg-1qCdQsZ4AaABAg","Berarti kalo pake ini gada kata internet gangguan 😂","4843","false","https://www.youtube.com/watch?v=U-ZyepruMh0","4 months ago","0",,"STARLINK INDONESIA REVIEW, INTERNET DARI LANGIT TANPA SINYAL DIMANAPUN ANDA BERADA (TERLENGKAP)","comment","U-ZyepruMh0","0"
"@evenemesis872","false","Ugy4RcEZs-41DW-4VmB4AaABAg","Kena pajak berapa bang? ada drama gag di bea cukai.....😂😂😂😂😂😂","4843","false","https://www.youtube.com/watch?v=U-ZyepruMh0","4 months ago","0",,"STARLINK INDONESIA REVIEW, INTERNET DARI LANGIT TANPA SINYAL DIMANAPUN ANDA BERADA (TERLENGKAP)","comment","U-ZyepruMh0","0"
"@Evrix22","false","UgyNbiupsqdw8VZUGAp4AaABAg","19:54 bapak2 bersantai sambil ML an di teras rumah tapi pake starlink, fix bukan bapak2 biasa","4843","false","https://www.youtube.com/watch?v=U-ZyepruMh0","4 months ago","0",,"STARLINK INDONESIA REVIEW, INTERNET DARI LANGIT TANPA SINYAL DIMANAPUN ANDA BERADA (TERLENGKAP)","comment","U-ZyepruMh0","0"
"@andricombat008","false","Ugz2jXyCI0r_SPONpUx4AaABAg","internet cepat buat apa?","4843","false","https://www.youtube.com/watch?v=U-ZyepruMh0","4 months ago","0",,"STARLINK INDONESIA REVIEW, INTERNET DARI LANGIT TANPA SINYAL DIMANAPUN ANDA BERADA (TERLENGKAP)","comment","U-ZyepruMh0","0"
"@pengamatmediasosial3715","false","Ugxp_arRhok22h9Jrrt4AaABAg","bro meh tekon jika tak bawa ke negara sebelah piye iseh iso gk dipakek","4843","false","https://www.youtube.com/watch?v=U-ZyepruMh0","4 months ago","0",,"STARLINK INDONESIA REVIEW, INTERNET DARI LANGIT TANPA SINYAL DIMANAPUN ANDA BERADA (TERLENGKAP)","comment","U-ZyepruMh0","0"
"@pqpchannel282","false","UgyUnMTxrOw6CFr_tW14AaABAg","Org ISP liht speed test nya senyum bae,,

Tu tidk asli,tu pakai bursh ,aslinya paling 20Mbps atau 30mbps","4843","false","https://www.youtube.com/watch?v=U-ZyepruMh0","4 months ago","0",,"STARLINK INDONESIA REVIEW, INTERNET DARI LANGIT TANPA SINYAL DIMANAPUN ANDA BERADA (TERLENGKAP)","comment","U-ZyepruMh0","0"
"@tiyokarif1362","false","Ugy7JQXAgD75ombypLN4AaABAg","nek hujan,mendung peteng speed internet tetep stabil mas?","4843","false","https://www.youtube.com/watch?v=U-ZyepruMh0","4 months ago","0",,"STARLINK INDONESIA REVIEW, INTERNET DARI LANGIT TANPA SINYAL DIMANAPUN ANDA BERADA (TERLENGKAP)","comment","U-ZyepruMh0","0"
"@shovatemongmere4584","false","UgxcqOdirq-8QeEv0aN4AaABAg","Buat war ticket bisa nih 😂","4843","false","https://www.youtube.com/watch?v=U-ZyepruMh0","4 months ago","0",,"STARLINK INDONESIA REVIEW, INTERNET DARI LANGIT TANPA SINYAL DIMANAPUN ANDA BERADA (TERLENGKAP)","comment","U-ZyepruMh0","0"
"@arnhynafn5606","false","Ugz6-nZ2avMU_ALl7uF4AaABAg","FLATEARTH HADIR ... ❤","4843","false","https://www.youtube.com/watch?v=U-ZyepruMh0","4 months ago","0",,"STARLINK INDONESIA REVIEW, INTERNET DARI LANGIT TANPA SINYAL DIMANAPUN ANDA BERADA (TERLENGKAP)","comment","U-ZyepruMh0","0"
"@itsmilosovich5899","false","UgzIQcy3MeqnLr-dcZZ4AaABAg","Kira kira buat bisnis bisa ngga ya?","4843","false","https://www.youtube.com/watch?v=U-ZyepruMh0","4 months ago","0",,"STARLINK INDONESIA REVIEW, INTERNET DARI LANGIT TANPA SINYAL DIMANAPUN ANDA BERADA (TERLENGKAP)","comment","U-ZyepruMh0","0"
"@InceInce-rd9nj","false","UgwcPWyxKVibSR6aAZx4AaABAg","Beli di link Shopee nya aman da?","4843","false","https://www.youtube.com/watch?v=U-ZyepruMh0","4 months ago","0",,"STARLINK INDONESIA REVIEW, INTERNET DARI LANGIT TANPA SINYAL DIMANAPUN ANDA BERADA (TERLENGKAP)","comment","U-ZyepruMh0","0"
"@ternakayam4106","false","UgxrJD8vlL95_odD5P54AaABAg","kalau 1 device / 1 account, bandwithnya di pecah boleh & bisa ga ? dibikin RT RW net ? soalnya kalau ISP lokal, Term & Cond nya, dilarang melakukan penjualan kembali baik sebagian maupun keseluruhan Layanan","4843","false","https://www.youtube.com/watch?v=U-ZyepruMh0","4 months ago","0",,"STARLINK INDONESIA REVIEW, INTERNET DARI LANGIT TANPA SINYAL DIMANAPUN ANDA BERADA (TERLENGKAP)","comment","U-ZyepruMh0","0"
"@banuaseeko8779","false","UgwgzEEhCBZ32uVkjXl4AaABAg","di tokopedia udah banyak mas....tapi harganya kokk dikisaran 11-17juta ya","4843","false","https://www.youtube.com/watch?v=U-ZyepruMh0","4 months ago","0",,"STARLINK INDONESIA REVIEW, INTERNET DARI LANGIT TANPA SINYAL DIMANAPUN ANDA BERADA (TERLENGKAP)","comment","U-ZyepruMh0","0"
"@cendoldawetandroid2171","false","UgzUhTg0iI_itSNliK94AaABAg","Bisa ni buat RT RW nett","4843","false","https://www.youtube.com/watch?v=U-ZyepruMh0","4 months ago","0",,"STARLINK INDONESIA REVIEW, INTERNET DARI LANGIT TANPA SINYAL DIMANAPUN ANDA BERADA (TERLENGKAP)","comment","U-ZyepruMh0","0"
"@NataLia-fm9vg","false","UgzgKx6-cZZ09RjX_oJ4AaABAg","Wah.., gawat.., pacar Abang laki2 semua..😄","4843","false","https://www.youtube.com/watch?v=U-ZyepruMh0","4 months ago","0",,"STARLINK INDONESIA REVIEW, INTERNET DARI LANGIT TANPA SINYAL DIMANAPUN ANDA BERADA (TERLENGKAP)","comment","U-ZyepruMh0","0"
"@shovatemongmere4584","false","Ugx4wIdNRoHGfmucWs94AaABAg","Pasangnya gampang Ka?","4843","false","https://www.youtube.com/watch?v=U-ZyepruMh0","4 months ago","0",,"STARLINK INDONESIA REVIEW, INTERNET DARI LANGIT TANPA SINYAL DIMANAPUN ANDA BERADA (TERLENGKAP)","comment","U-ZyepruMh0","0"
"@Andre00-zv2uu","false","Ugx6gmPAyGTaM1qghdZ4AaABAg","Mas, kalo pindah lokasi gimana ?
di lokasi 1 saya install bisa online, pindah ke lokasi 2 jarak beda provinsi ratusan kilo tidak bisa online notifikasi error nya lokasi tidak ter register/tidak terduga dan tidak bisa online .
mohon dibantu","4843","false","https://www.youtube.com/watch?v=U-ZyepruMh0","4 months ago","0",,"STARLINK INDONESIA REVIEW, INTERNET DARI LANGIT TANPA SINYAL DIMANAPUN ANDA BERADA (TERLENGKAP)","comment","U-ZyepruMh0","0"
"@ervansaputro1078","false","Ugwjcx3FqeKBDV6wTvx4AaABAg","nek udan atau mendung piye mas? aman? klo pakai perkantoran aman ora yo kiro2?","4843","false","https://www.youtube.com/watch?v=U-ZyepruMh0","4 months ago","0",,"STARLINK INDONESIA REVIEW, INTERNET DARI LANGIT TANPA SINYAL DIMANAPUN ANDA BERADA (TERLENGKAP)","comment","U-ZyepruMh0","0"
"@mymna03","false","UgzsCkSYtdkurwTJdap4AaABAg","Udh prnah cb lake rame2 >30org g?","4843","false","https://www.youtube.com/watch?v=U-ZyepruMh0","4 months ago","0",,"STARLINK INDONESIA REVIEW, INTERNET DARI LANGIT TANPA SINYAL DIMANAPUN ANDA BERADA (TERLENGKAP)","comment","U-ZyepruMh0","0"
"@doniosmon4541","false","UgwDEIdhw9hMzF43s4h4AaABAg","gimana kalau kondisi cuaca berawan dan hujan  apakah sinyalnya masih tetap atau hilang atau masih ada tapi kecepatannya berkurang. untuk memperluas areanya apa bisa pakai microtik mas","4843","false","https://www.youtube.com/watch?v=U-ZyepruMh0","4 months ago (edited)","0",,"STARLINK INDONESIA REVIEW, INTERNET DARI LANGIT TANPA SINYAL DIMANAPUN ANDA BERADA (TERLENGKAP)","comment","U-ZyepruMh0","0"
"@jonihendra4825","false","UgzuW5fZ1n5QWVG_4H94AaABAg","Kalau mau pakai satu kampung gimana mas masalah nya di kampung ku belum ada Singal internet nya","4843","false","https://www.youtube.com/watch?v=U-ZyepruMh0","4 months ago","0",,"STARLINK INDONESIA REVIEW, INTERNET DARI LANGIT TANPA SINYAL DIMANAPUN ANDA BERADA (TERLENGKAP)","comment","U-ZyepruMh0","0"
"@r.robbi.s3319","false","UgxBy5jrut_C35Kma_F4AaABAg","mbok dikurangi anjire mas","4843","false","https://www.youtube.com/watch?v=U-ZyepruMh0","4 months ago","0",,"STARLINK INDONESIA REVIEW, INTERNET DARI LANGIT TANPA SINYAL DIMANAPUN ANDA BERADA (TERLENGKAP)","comment","U-ZyepruMh0","0"
"@Vandamjr-vj4oq","false","UgxoNJl-_j4QqDh-3FN4AaABAg","Coba ngetest nya di tengah laut lepas bang, klo bisa dpet sinyal pasti banyak yg mau beli","4843","false","https://www.youtube.com/watch?v=U-ZyepruMh0","4 months ago","0",,"STARLINK INDONESIA REVIEW, INTERNET DARI LANGIT TANPA SINYAL DIMANAPUN ANDA BERADA (TERLENGKAP)","comment","U-ZyepruMh0","0"
"@zhippulreload4788","false","UgzhiHaNVEi0z_-bbYF4AaABAg","Bang starlink bisa dikoneksikan ke mikrotik ngga?","4843","false","https://www.youtube.com/watch?v=U-ZyepruMh0","4 months ago","0",,"STARLINK INDONESIA REVIEW, INTERNET DARI LANGIT TANPA SINYAL DIMANAPUN ANDA BERADA (TERLENGKAP)","comment","U-ZyepruMh0","0"
"@danunwirama8073","false","UgyYl1VkacENw5PRph94AaABAg","mantap videonya bang, bisa konek berapa device ini ya?","4843","false","https://www.youtube.com/watch?v=U-ZyepruMh0","4 months ago","0",,"STARLINK INDONESIA REVIEW, INTERNET DARI LANGIT TANPA SINYAL DIMANAPUN ANDA BERADA (TERLENGKAP)","comment","U-ZyepruMh0","0"
"@Harquyla","false","Ugw3NxQ6vkum6-NnAh14AaABAg","750rb? yang lumayan murahlah bisa dipakai di kampung. Tapi harus beli alatnya 7,8jt. ok.. MAHAL :face-pink-tears::face-pink-tears:","4843","false","https://www.youtube.com/watch?v=U-ZyepruMh0","4 months ago","0",,"STARLINK INDONESIA REVIEW, INTERNET DARI LANGIT TANPA SINYAL DIMANAPUN ANDA BERADA (TERLENGKAP)","comment","U-ZyepruMh0","0"
"@JAY18082","false","Ugw5qKOkLupm6yBYp5R4AaABAg","Saya punya yang versi litenya bang , tplink","4843","false","https://www.youtube.com/watch?v=U-ZyepruMh0","4 months ago","0",,"STARLINK INDONESIA REVIEW, INTERNET DARI LANGIT TANPA SINYAL DIMANAPUN ANDA BERADA (TERLENGKAP)","comment","U-ZyepruMh0","0"
"@rjk3981","false","UgyIttzCvt7X9R722gF4AaABAg","Satelit ndasmu😂","4843","false","https://www.youtube.com/watch?v=U-ZyepruMh0","4 months ago","0",,"STARLINK INDONESIA REVIEW, INTERNET DARI LANGIT TANPA SINYAL DIMANAPUN ANDA BERADA (TERLENGKAP)","comment","U-ZyepruMh0","0"
"@wuaseeek7868","false","UgwCotQ4MHHe9vbHlid4AaABAg","Ih mampus banget utk dunia broadcast akan pangkas 8 orang crew sng 🤦🏻‍♂️","4843","false","https://www.youtube.com/watch?v=U-ZyepruMh0","4 months ago","0",,"STARLINK INDONESIA REVIEW, INTERNET DARI LANGIT TANPA SINYAL DIMANAPUN ANDA BERADA (TERLENGKAP)","comment","U-ZyepruMh0","0"
"@jdsulistyabud8399","false","Ugym2jk1FzkUBxm3L5B4AaABAg","Jooos👍","4843","false","https://www.youtube.com/watch?v=U-ZyepruMh0","5 months ago","0",,"STARLINK INDONESIA REVIEW, INTERNET DARI LANGIT TANPA SINYAL DIMANAPUN ANDA BERADA (TERLENGKAP)","comment","U-ZyepruMh0","0"
"@KabupatenJember-wy2bn","false","UgzYqeBFyxlzjqLYqQR4AaABAg","Mas kuwi nek di konek ke mikrotik apa bisa","4843","false","https://www.youtube.com/watch?v=U-ZyepruMh0","5 months ago","0",,"STARLINK INDONESIA REVIEW, INTERNET DARI LANGIT TANPA SINYAL DIMANAPUN ANDA BERADA (TERLENGKAP)","comment","U-ZyepruMh0","0"
"@donyfirmansyah7309","false","Ugxmkc6x1AQhQ82qC7Z4AaABAg","Kl buat di daerah yg signal blm bgs pilihan starlink jd solusi. Tp kl indihome sdh masuk terasa mahal hrgnya. di kota jkrt speed test download bs 43 MBPS","4843","false","https://www.youtube.com/watch?v=U-ZyepruMh0","5 months ago","0",,"STARLINK INDONESIA REVIEW, INTERNET DARI LANGIT TANPA SINYAL DIMANAPUN ANDA BERADA (TERLENGKAP)","comment","U-ZyepruMh0","0"
"@samsulrizal330","false","UgznEStOFxPv1gsGSbl4AaABAg","hebat mas promosinya .....","4843","false","https://www.youtube.com/watch?v=U-ZyepruMh0","5 months ago","0",,"STARLINK INDONESIA REVIEW, INTERNET DARI LANGIT TANPA SINYAL DIMANAPUN ANDA BERADA (TERLENGKAP)","comment","U-ZyepruMh0","0"
"@GIF_IG","false","UgxT5BIv5twZULcObmJ4AaABAg","Starlink bukannya warkop keliling 😂
St4rbuck kelilink wkwkw","4843","false","https://www.youtube.com/watch?v=U-ZyepruMh0","5 months ago","0",,"STARLINK INDONESIA REVIEW, INTERNET DARI LANGIT TANPA SINYAL DIMANAPUN ANDA BERADA (TERLENGKAP)","comment","U-ZyepruMh0","0"
"@mileniumponsel5120","false","UgzZgkMUJ_XXrX3jcAl4AaABAg","Bisa di setting untuk wifi voucher an gak tuh mase.?","4843","false","https://www.youtube.com/watch?v=U-ZyepruMh0","5 months ago","0",,"STARLINK INDONESIA REVIEW, INTERNET DARI LANGIT TANPA SINYAL DIMANAPUN ANDA BERADA (TERLENGKAP)","comment","U-ZyepruMh0","0"
"@dunnolutong","false","UgzpvQX1ZLXfM6dQujl4AaABAg","Sy suka gaya bicaranya khas orang manado","4843","false","https://www.youtube.com/watch?v=U-ZyepruMh0","5 months ago","0",,"STARLINK INDONESIA REVIEW, INTERNET DARI LANGIT TANPA SINYAL DIMANAPUN ANDA BERADA (TERLENGKAP)","comment","U-ZyepruMh0","0"
"@holamilan242","false","UgwCzTdBfalMvJ9PDFh4AaABAg","Gokil memang produk nya si melon 😲","4843","false","https://www.youtube.com/watch?v=U-ZyepruMh0","5 months ago","0",,"STARLINK INDONESIA REVIEW, INTERNET DARI LANGIT TANPA SINYAL DIMANAPUN ANDA BERADA (TERLENGKAP)","comment","U-ZyepruMh0","0"
"@sandiwijaya-jb4nj","false","Ugx5OcYM3oDEMS_ck3B4AaABAg","Gw selama ini gak mikirin internet, Karna numpang wifi tetangga gratis udah bertahun2...makanya kalian jangan mau punya tetangga pelit,wkwkwkwk...","4843","false","https://www.youtube.com/watch?v=U-ZyepruMh0","5 months ago","0",,"STARLINK INDONESIA REVIEW, INTERNET DARI LANGIT TANPA SINYAL DIMANAPUN ANDA BERADA (TERLENGKAP)","comment","U-ZyepruMh0","0"
"@rendyyt9683","false","UgyKFngmoPVF8eBya0J4AaABAg","hebat ya mang elon 😅","4843","false","https://www.youtube.com/watch?v=U-ZyepruMh0","5 months ago","0",,"STARLINK INDONESIA REVIEW, INTERNET DARI LANGIT TANPA SINYAL DIMANAPUN ANDA BERADA (TERLENGKAP)","comment","U-ZyepruMh0","0"
"@lha4530","false","Ugz_h-FABrWcYz08wi54AaABAg","Mantap❤️❤️👍👍","4843","false","https://www.youtube.com/watch?v=U-ZyepruMh0","5 months ago","0",,"STARLINK INDONESIA REVIEW, INTERNET DARI LANGIT TANPA SINYAL DIMANAPUN ANDA BERADA (TERLENGKAP)","comment","U-ZyepruMh0","0"
"@DausSepanggal","false","UgyQ3xdxjz1R659gMIV4AaABAg","nunggu review yang versi tambahan LAN","4843","false","https://www.youtube.com/watch?v=U-ZyepruMh0","5 months ago","0",,"STARLINK INDONESIA REVIEW, INTERNET DARI LANGIT TANPA SINYAL DIMANAPUN ANDA BERADA (TERLENGKAP)","comment","U-ZyepruMh0","0"
"@siswarno8010","false","UgxWCwoocJQ_mw15XyZ4AaABAg","Kenapa saya coba pesan alamatnya status invalid terus ya","4843","false","https://www.youtube.com/watch?v=U-ZyepruMh0","5 months ago","0",,"STARLINK INDONESIA REVIEW, INTERNET DARI LANGIT TANPA SINYAL DIMANAPUN ANDA BERADA (TERLENGKAP)","comment","U-ZyepruMh0","0"
"@astrolp2585","false","UgxKVCANtKsHWG9WQtN4AaABAg","Canggihe cah dolanane Wong amrik❤❤❤❤❤","4843","false","https://www.youtube.com/watch?v=U-ZyepruMh0","5 months ago","0",,"STARLINK INDONESIA REVIEW, INTERNET DARI LANGIT TANPA SINYAL DIMANAPUN ANDA BERADA (TERLENGKAP)","comment","U-ZyepruMh0","0"
"@cakhopang7461","false","UgxsAZPGpN-kYs0VUQF4AaABAg","Waalaikumussalam. Warahmatullahi Wabarakaatuh. Wis tak tonton sampek entek iki Cak Nanang yang ceria. Kapan-kapan dicoba nang Bekasi, Cak. Matur Suwun.","4843","true","https://www.youtube.com/watch?v=U-ZyepruMh0","5 months ago","0",,"STARLINK INDONESIA REVIEW, INTERNET DARI LANGIT TANPA SINYAL DIMANAPUN ANDA BERADA (TERLENGKAP)","comment","U-ZyepruMh0","8"
"@zamansky786","false","UgzjDhcZ2r3TX5gHlGd4AaABAg","Rohingya","4843","false","https://www.youtube.com/watch?v=U-ZyepruMh0","5 months ago","0",,"STARLINK INDONESIA REVIEW, INTERNET DARI LANGIT TANPA SINYAL DIMANAPUN ANDA BERADA (TERLENGKAP)","comment","U-ZyepruMh0","0"
"@banggillmoto1116","false","UgwCpyYjpDWFp2A5KPZ4AaABAg","Pasang starlink biaya bulanan 750rb, beli alat 7,8jt. Dipake buat main slot.","4843","false","https://www.youtube.com/watch?v=U-ZyepruMh0","5 months ago","0",,"STARLINK INDONESIA REVIEW, INTERNET DARI LANGIT TANPA SINYAL DIMANAPUN ANDA BERADA (TERLENGKAP)","comment","U-ZyepruMh0","0"
"@banggillmoto1116","false","UgzJt8Jr-ERMp3RLeGx4AaABAg","Kalau starlink bisa untuk rt rw net?","4843","false","https://www.youtube.com/watch?v=U-ZyepruMh0","5 months ago","0",,"STARLINK INDONESIA REVIEW, INTERNET DARI LANGIT TANPA SINYAL DIMANAPUN ANDA BERADA (TERLENGKAP)","comment","U-ZyepruMh0","0"
"@sultanprawiro3069","false","Ugykz_l9V8SonEWqYWV4AaABAg","btw brawl itu lebih lancar bro dibanding ranked dalam hal ping,soalnya sering ngetest di brawl lancar ehh di ranked ping merah","4843","false","https://www.youtube.com/watch?v=U-ZyepruMh0","5 months ago","1",,"STARLINK INDONESIA REVIEW, INTERNET DARI LANGIT TANPA SINYAL DIMANAPUN ANDA BERADA (TERLENGKAP)","comment","U-ZyepruMh0","0"
"@sultanprawiro3069","false","UgyUGgmRjnAbuQNg2Gh4AaABAg","Itu bisa dipakai beberapa orang kan bang?","4843","false","https://www.youtube.com/watch?v=U-ZyepruMh0","5 months ago","0",,"STARLINK INDONESIA REVIEW, INTERNET DARI LANGIT TANPA SINYAL DIMANAPUN ANDA BERADA (TERLENGKAP)","comment","U-ZyepruMh0","0"
"@rznetwork10","false","Ugwa0NTLu9ae7vD4eMF4AaABAg","buat nonton netflix 4k sepuasnya no buffering 😂","4843","false","https://www.youtube.com/watch?v=U-ZyepruMh0","5 months ago","0",,"STARLINK INDONESIA REVIEW, INTERNET DARI LANGIT TANPA SINYAL DIMANAPUN ANDA BERADA (TERLENGKAP)","comment","U-ZyepruMh0","0"
"@aioioo9896","false","UgzqiZIWZFYNq6_ZrWd4AaABAg","Hihihi.....for rural area and bad internet infrastructure only. Hihi...crazy all of us, lets use it for communities for share..hihihi...","4843","false","https://www.youtube.com/watch?v=U-ZyepruMh0","5 months ago","0",,"STARLINK INDONESIA REVIEW, INTERNET DARI LANGIT TANPA SINYAL DIMANAPUN ANDA BERADA (TERLENGKAP)","comment","U-ZyepruMh0","0"
"@BayU_Official..","false","UgzqDERzv5qaa8MWBO54AaABAg","Daya tahannya perlu uji kena ujan & matahari, mengingat ini bakalan ditaro di ruang terbuka, itu starlink soalnya ada mesinnya","4843","false","https://www.youtube.com/watch?v=U-ZyepruMh0","5 months ago","0",,"STARLINK INDONESIA REVIEW, INTERNET DARI LANGIT TANPA SINYAL DIMANAPUN ANDA BERADA (TERLENGKAP)","comment","U-ZyepruMh0","0"
"@randomeqlip3812","false","UgwHaW4rd0dlU43gBax4AaABAg","Mahal uy Harga device nya 7,8jt","4843","false","https://www.youtube.com/watch?v=U-ZyepruMh0","5 months ago","0",,"STARLINK INDONESIA REVIEW, INTERNET DARI LANGIT TANPA SINYAL DIMANAPUN ANDA BERADA (TERLENGKAP)","comment","U-ZyepruMh0","0"
"@edo..11","false","Ugw4lH_CPhfbzmAIZ5F4AaABAg","Di sini lah, ada yg yakin, bahwa bumi itu datar?😂","4843","false","https://www.youtube.com/watch?v=U-ZyepruMh0","5 months ago","0",,"STARLINK INDONESIA REVIEW, INTERNET DARI LANGIT TANPA SINYAL DIMANAPUN ANDA BERADA (TERLENGKAP)","comment","U-ZyepruMh0","0"
"@biographyfigure6706","false","Ugw-L5MM4u_Dq1AWCwJ4AaABAg","delay itu kalo game","4843","false","https://www.youtube.com/watch?v=U-ZyepruMh0","5 months ago","0",,"STARLINK INDONESIA REVIEW, INTERNET DARI LANGIT TANPA SINYAL DIMANAPUN ANDA BERADA (TERLENGKAP)","comment","U-ZyepruMh0","0"
