"author","authorIsChannelOwner","cid","comment","commentsCount","hasCreatorHeart","pageUrl","publishedTimeText","replyCount","replyToCid","title","type","videoId","voteCount"
"@GanaYurato","false","UgwBbj1_vPVY44kCvK94AaABAg","Bg, buat video rekomendasi modem + antena untuk penangkap sinyal tower/ isp","4843","false","https://www.youtube.com/watch?v=U-ZyepruMh0","4 months ago","0",,"STARLINK INDONESIA REVIEW, INTERNET DARI LANGIT TANPA SINYAL DIMANAPUN ANDA BERADA (TERLENGKAP)","comment","U-ZyepruMh0","0"
"@siboy3304","false","Ugw3ZcoVKY2P3Jj7mI14AaABAg","Bentarlagi telkom wassalam....","4843","false","https://www.youtube.com/watch?v=U-ZyepruMh0","4 months ago","0",,"STARLINK INDONESIA REVIEW, INTERNET DARI LANGIT TANPA SINYAL DIMANAPUN ANDA BERADA (TERLENGKAP)","comment","U-ZyepruMh0","0"
"@siboy3304","false","UgyM70mjkwKQOlpe9ZF4AaABAg","Kecepatan segitu sudah Josslah... Ga ada lawan...!!!","4843","false","https://www.youtube.com/watch?v=U-ZyepruMh0","4 months ago","0",,"STARLINK INDONESIA REVIEW, INTERNET DARI LANGIT TANPA SINYAL DIMANAPUN ANDA BERADA (TERLENGKAP)","comment","U-ZyepruMh0","1"
"@AmaBurgethOfficial","false","UgxmeBHEvzmKO483Xr14AaABAg","keren ya,,,, apa bisa hospot sama kaya wifi atau bagaimna bang:person-turqouise-waving:apa bisa terhubung banyak orang","4843","false","https://www.youtube.com/watch?v=U-ZyepruMh0","4 months ago (edited)","0",,"STARLINK INDONESIA REVIEW, INTERNET DARI LANGIT TANPA SINYAL DIMANAPUN ANDA BERADA (TERLENGKAP)","comment","U-ZyepruMh0","0"
"@stearted","false","Ugy1_DeO77d6bTapoEh4AaABAg","Ini mungkin bisa digunakan untuk ditengah laut","4843","false","https://www.youtube.com/watch?v=U-ZyepruMh0","4 months ago","0",,"STARLINK INDONESIA REVIEW, INTERNET DARI LANGIT TANPA SINYAL DIMANAPUN ANDA BERADA (TERLENGKAP)","comment","U-ZyepruMh0","0"
"@Ariezz_82","false","UgwHWDgDv8sb8BI5EJR4AaABAg","Starlink lebih worth it & recommended di wilayah yg tidak terjangkau oleh Operator seluler..atau para Viking & tim adventure yg demen healing ke Gunung & Hutan..","4843","false","https://www.youtube.com/watch?v=U-ZyepruMh0","4 months ago","0",,"STARLINK INDONESIA REVIEW, INTERNET DARI LANGIT TANPA SINYAL DIMANAPUN ANDA BERADA (TERLENGKAP)","comment","U-ZyepruMh0","0"
"@bigaraja4007","false","UgyM88TSTLWlJiJ4Crp4AaABAg","starlink coverage layanan diseluruh wilayah nkri tdk asa blank spot.","4843","false","https://www.youtube.com/watch?v=U-ZyepruMh0","4 months ago","0",,"STARLINK INDONESIA REVIEW, INTERNET DARI LANGIT TANPA SINYAL DIMANAPUN ANDA BERADA (TERLENGKAP)","comment","U-ZyepruMh0","0"
"@Lara-wi6hv","false","UgyUHX5oAkfzZ-dQNTd4AaABAg","Biznet ku 150 mbps aja udah cukup banget, udah ngebut bgt.. wkwkk.. heboh kali abang kuh","4843","false","https://www.youtube.com/watch?v=U-ZyepruMh0","4 months ago","0",,"STARLINK INDONESIA REVIEW, INTERNET DARI LANGIT TANPA SINYAL DIMANAPUN ANDA BERADA (TERLENGKAP)","comment","U-ZyepruMh0","0"
"@ekoagus5836","false","UgzWLfjFKNdC0wYnsUN4AaABAg","Ngasih tau aja, kalo yg di pedalaman pake starlink, pastikan listrik nya stabil, saya udah ngalamin waktu pasang di Kalimantan utara tahun kemarin, pale genset karena ga ada PLN, genset nya tiba-tiba naik tegangan, dan rusak akhirnya.","4843","false","https://www.youtube.com/watch?v=U-ZyepruMh0","4 months ago","2",,"STARLINK INDONESIA REVIEW, INTERNET DARI LANGIT TANPA SINYAL DIMANAPUN ANDA BERADA (TERLENGKAP)","comment","U-ZyepruMh0","2"
"@AntipGeneration-cq1ev","false","Ugy_r7rPJUxP0QybALJ4AaABAg","Alah digembar gembor,tetep aja bayar😏.
 Dan klw kekampung kampung/pelosok desaMh tetap aja hrs beli alatNya lagi,ditambah tiap bulanNya🙆.
 Rakyat kecilMh  sllu😭😭.
Org kampungMh susah pengen main bola negara sendiri aja,hrs pnya alat lagi,tv sllu di dabling,miris negara konohaMh😭..katanya negara kaya😏.
Habis starlink apa lgi entar kedepanNya?😁","4843","false","https://www.youtube.com/watch?v=U-ZyepruMh0","4 months ago (edited)","0",,"STARLINK INDONESIA REVIEW, INTERNET DARI LANGIT TANPA SINYAL DIMANAPUN ANDA BERADA (TERLENGKAP)","comment","U-ZyepruMh0","0"
"@danielpras1106","false","UgyuXpHazrluun7q-AJ4AaABAg.A3hEcVv8Un2A3hLgm5ylO9","Paket internet di kota brapa harganya kecepatan 200mb?","4843","false","https://www.youtube.com/watch?v=U-ZyepruMh0","4 months ago","0","UgyuXpHazrluun7q-AJ4AaABAg","STARLINK INDONESIA REVIEW, INTERNET DARI LANGIT TANPA SINYAL DIMANAPUN ANDA BERADA (TERLENGKAP)","reply","U-ZyepruMh0","0"
"@jaywalker6464","false","UgyuXpHazrluun7q-AJ4AaABAg.A3hEcVv8Un2A3sgMOkr1AR"," @danielpras1106  250mb 575rb","4843","false","https://www.youtube.com/watch?v=U-ZyepruMh0","4 months ago","0","UgyuXpHazrluun7q-AJ4AaABAg","STARLINK INDONESIA REVIEW, INTERNET DARI LANGIT TANPA SINYAL DIMANAPUN ANDA BERADA (TERLENGKAP)","reply","U-ZyepruMh0","0"
"@jaywalker6464","false","UgyuXpHazrluun7q-AJ4AaABAg.A3hEcVv8Un2A3sgj9fK-LF"," @danielpras1106  ambil setahun bayar 9bln.","4843","false","https://www.youtube.com/watch?v=U-ZyepruMh0","4 months ago","0","UgyuXpHazrluun7q-AJ4AaABAg","STARLINK INDONESIA REVIEW, INTERNET DARI LANGIT TANPA SINYAL DIMANAPUN ANDA BERADA (TERLENGKAP)","reply","U-ZyepruMh0","0"
"@IndraIrawan-e7l","false","UgzWLfjFKNdC0wYnsUN4AaABAg.A3gv0k2kSoiA3jzdnwnPlQ","Mestinyan. Pake.. Mcb biar arus.stabil jgn langsung sambung ke.. Alat pengguna.. Rmh.","4843","false","https://www.youtube.com/watch?v=U-ZyepruMh0","4 months ago","0","UgzWLfjFKNdC0wYnsUN4AaABAg","STARLINK INDONESIA REVIEW, INTERNET DARI LANGIT TANPA SINYAL DIMANAPUN ANDA BERADA (TERLENGKAP)","reply","U-ZyepruMh0","0"
"@maskajiradit4950","false","UgzWLfjFKNdC0wYnsUN4AaABAg.A3gv0k2kSoiA3t1TNnqMHH","Harusnya pakai stavol biar listrik stabil apalagi alat2 gini wajib pakai​ @IndraIrawan-e7l ","4843","false","https://www.youtube.com/watch?v=U-ZyepruMh0","4 months ago","0","UgzWLfjFKNdC0wYnsUN4AaABAg","STARLINK INDONESIA REVIEW, INTERNET DARI LANGIT TANPA SINYAL DIMANAPUN ANDA BERADA (TERLENGKAP)","reply","U-ZyepruMh0","0"
"@davidsergius1211","false","UgyzAhmoEOmT67x9WgZ4AaABAg","semoga kedepannya untuk paket starlinknya lebih murah 😁","4843","false","https://www.youtube.com/watch?v=U-ZyepruMh0","4 months ago","0",,"STARLINK INDONESIA REVIEW, INTERNET DARI LANGIT TANPA SINYAL DIMANAPUN ANDA BERADA (TERLENGKAP)","comment","U-ZyepruMh0","0"
"@keysautamamandiri1907","false","UgwMYWE82BD48QwwgQR4AaABAg","Ada biaya bulanan ? Sampai berapa","4843","false","https://www.youtube.com/watch?v=U-ZyepruMh0","4 months ago","1",,"STARLINK INDONESIA REVIEW, INTERNET DARI LANGIT TANPA SINYAL DIMANAPUN ANDA BERADA (TERLENGKAP)","comment","U-ZyepruMh0","0"
"@rnduqi","false","UgyVu0_Z-myqccMzULh4AaABAg","Mas coba dicek IP publiknya starlink ke negara mana?","4843","false","https://www.youtube.com/watch?v=U-ZyepruMh0","4 months ago","0",,"STARLINK INDONESIA REVIEW, INTERNET DARI LANGIT TANPA SINYAL DIMANAPUN ANDA BERADA (TERLENGKAP)","comment","U-ZyepruMh0","0"
"@rudyindex7016","false","UgxE5E5dvnDjQLFAOhp4AaABAg","Dan kedepan hidup kita dlm genggaman mereka...","4843","false","https://www.youtube.com/watch?v=U-ZyepruMh0","4 months ago","0",,"STARLINK INDONESIA REVIEW, INTERNET DARI LANGIT TANPA SINYAL DIMANAPUN ANDA BERADA (TERLENGKAP)","comment","U-ZyepruMh0","0"
"@visiontv-vj8dh","false","Ugz0JYPp6CR6JTKpzjN4AaABAg","bisa untuk rt rw net g mas nanang. ..?","4843","false","https://www.youtube.com/watch?v=U-ZyepruMh0","4 months ago","0",,"STARLINK INDONESIA REVIEW, INTERNET DARI LANGIT TANPA SINYAL DIMANAPUN ANDA BERADA (TERLENGKAP)","comment","U-ZyepruMh0","0"
"@kabiru69","false","UgycH3PstiX_OJbrYLl4AaABAg","ini kan white alice versi mini😂
SILAHKAN SEARCH DAN BACA SENDIRI APA ITU WHITE ALICE

militer iran dan korut tidak pernah punya satelit tapi kemajuan alutsista mereka sangat keren, masih percaya dengan satelit?😂

ngomongin teknologi apapun itu pengguna pertama PASTI militer 
si musang musk sukses kibulin kalian 😂","4843","false","https://www.youtube.com/watch?v=U-ZyepruMh0","4 months ago","0",,"STARLINK INDONESIA REVIEW, INTERNET DARI LANGIT TANPA SINYAL DIMANAPUN ANDA BERADA (TERLENGKAP)","comment","U-ZyepruMh0","0"
"@ukib.rahmat5810","false","UgyIB_yuKNLDQnAY1Yx4AaABAg","mas Nanank, ""anyiiing"" itu cuma buat orang sunda mas 🤣😂","4843","false","https://www.youtube.com/watch?v=U-ZyepruMh0","4 months ago","0",,"STARLINK INDONESIA REVIEW, INTERNET DARI LANGIT TANPA SINYAL DIMANAPUN ANDA BERADA (TERLENGKAP)","comment","U-ZyepruMh0","0"
"@davidsaputra9120","false","Ugwq9wRJVRCuxpj76cJ4AaABAg","Itu ada FUP nya gak mas, kek misal sebulan abis 1T speed turun gak","4843","false","https://www.youtube.com/watch?v=U-ZyepruMh0","4 months ago","0",,"STARLINK INDONESIA REVIEW, INTERNET DARI LANGIT TANPA SINYAL DIMANAPUN ANDA BERADA (TERLENGKAP)","comment","U-ZyepruMh0","0"
"@Vbxyj-i3s","false","Ugw1HWwMqMcwKbxhZg94AaABAg","Besok pake Starlink.... Super lancar","4843","false","https://www.youtube.com/watch?v=U-ZyepruMh0","4 months ago","0",,"STARLINK INDONESIA REVIEW, INTERNET DARI LANGIT TANPA SINYAL DIMANAPUN ANDA BERADA (TERLENGKAP)","comment","U-ZyepruMh0","0"
"@clipperszero","false","UgwCnLlar-ijwIrUkSN4AaABAg","Harganya jauh lebih mahal di banding internet kabel... Dan sejauh ini internet kabel sangat cukup untuk keperluan berbagai hal.. Kek turnamen turnamen game profesional semuanya pake kabel.. Streamer streamer di Indonesia semua juga pake kabel.. 

Lalu ketika cuaca tidak mendukung internet satelit  100persen terpengaruh.. Cuman besar kecilnya tergantung.. Kalo ada yg bilang aman aman aja hoax.. Orang lewat sinyal diudara.. Kalo hujan kecil ok mungkin ga pengaruh nah di indo ga selalu ujan kecil malah banyakan hujan deres","4843","false","https://www.youtube.com/watch?v=U-ZyepruMh0","4 months ago","0",,"STARLINK INDONESIA REVIEW, INTERNET DARI LANGIT TANPA SINYAL DIMANAPUN ANDA BERADA (TERLENGKAP)","comment","U-ZyepruMh0","0"
"@muhammadidris4668","false","Ugy7v0RoplNH2BMmkG54AaABAg","brp sebulan byar nya","4843","false","https://www.youtube.com/watch?v=U-ZyepruMh0","4 months ago","3",,"STARLINK INDONESIA REVIEW, INTERNET DARI LANGIT TANPA SINYAL DIMANAPUN ANDA BERADA (TERLENGKAP)","comment","U-ZyepruMh0","0"
"@setiawanndw","false","Ugw7Kzt9jtok7HCz5Vx4AaABAg","berarti nggak bisa di tambah perangkat lagi di bawah routernya si starlink? misal di tambah router gitu","4843","false","https://www.youtube.com/watch?v=U-ZyepruMh0","4 months ago","0",,"STARLINK INDONESIA REVIEW, INTERNET DARI LANGIT TANPA SINYAL DIMANAPUN ANDA BERADA (TERLENGKAP)","comment","U-ZyepruMh0","0"
"@wahyupurnomosidi8671","false","UgyYfMdJAoZN5Ke-Sqt4AaABAg","Anget2 tai ayam, setelah berjalan beberapa bulan pasti akan terasa tidak se perti yg digembar gemborkan","4843","false","https://www.youtube.com/watch?v=U-ZyepruMh0","4 months ago","0",,"STARLINK INDONESIA REVIEW, INTERNET DARI LANGIT TANPA SINYAL DIMANAPUN ANDA BERADA (TERLENGKAP)","comment","U-ZyepruMh0","0"
"@dev4live313","false","UgxMHbRdjBkoTZBGdtx4AaABAg","njengan ndak kudus mas?","4843","false","https://www.youtube.com/watch?v=U-ZyepruMh0","4 months ago","0",,"STARLINK INDONESIA REVIEW, INTERNET DARI LANGIT TANPA SINYAL DIMANAPUN ANDA BERADA (TERLENGKAP)","comment","U-ZyepruMh0","0"
"@armansaila122","false","UgwjxRvfEqnclrLME2t4AaABAg","Misalkan routernya di rumah kitanya tempat jauh apa bisa mas","4843","false","https://www.youtube.com/watch?v=U-ZyepruMh0","4 months ago","0",,"STARLINK INDONESIA REVIEW, INTERNET DARI LANGIT TANPA SINYAL DIMANAPUN ANDA BERADA (TERLENGKAP)","comment","U-ZyepruMh0","0"
"@ModemStarorbit","false","UgzperqoPQxqUALpNFx4AaABAg","Belinya di mana?","4843","false","https://www.youtube.com/watch?v=U-ZyepruMh0","4 months ago","0",,"STARLINK INDONESIA REVIEW, INTERNET DARI LANGIT TANPA SINYAL DIMANAPUN ANDA BERADA (TERLENGKAP)","comment","U-ZyepruMh0","0"
"@kevinstradlin2826","false","Ugz2imMcQTuJ3yZ4y3x4AaABAg","Bang kalau sy beli di australia terus bawah k indo bisa lgsng d pake di indo?","4843","false","https://www.youtube.com/watch?v=U-ZyepruMh0","4 months ago","0",,"STARLINK INDONESIA REVIEW, INTERNET DARI LANGIT TANPA SINYAL DIMANAPUN ANDA BERADA (TERLENGKAP)","comment","U-ZyepruMh0","0"
"@WajahChannelAdventure1","false","UgwtxTa0wQQTWVwDrXJ4AaABAg","ku putar berulang, sampe kebawa mimpi buat beli starlink, sangat menggoda","4843","false","https://www.youtube.com/watch?v=U-ZyepruMh0","4 months ago","0",,"STARLINK INDONESIA REVIEW, INTERNET DARI LANGIT TANPA SINYAL DIMANAPUN ANDA BERADA (TERLENGKAP)","comment","U-ZyepruMh0","0"
"@mabruralam3767","false","UgxSdJDo71zlz8kPZ614AaABAg","Apakah ini cocok buat usaha wifi voceran?","4843","false","https://www.youtube.com/watch?v=U-ZyepruMh0","4 months ago","0",,"STARLINK INDONESIA REVIEW, INTERNET DARI LANGIT TANPA SINYAL DIMANAPUN ANDA BERADA (TERLENGKAP)","comment","U-ZyepruMh0","0"
"@ericktrulala2919","false","UgxwLv9TS_7yO-962kt4AaABAg","gak cocok buat game kalau ping 32 ms yg udah pasti latency gak  cukup buat war di dalam game yg harus punya 20ms kebawah","4843","false","https://www.youtube.com/watch?v=U-ZyepruMh0","4 months ago","0",,"STARLINK INDONESIA REVIEW, INTERNET DARI LANGIT TANPA SINYAL DIMANAPUN ANDA BERADA (TERLENGKAP)","comment","U-ZyepruMh0","0"
"@fachryhusaini8137","false","UgwMYWE82BD48QwwgQR4AaABAg.A3gp1q3f1xcA3gwwBGotWl","750 rb perbulan","4843","false","https://www.youtube.com/watch?v=U-ZyepruMh0","4 months ago","0","UgwMYWE82BD48QwwgQR4AaABAg","STARLINK INDONESIA REVIEW, INTERNET DARI LANGIT TANPA SINYAL DIMANAPUN ANDA BERADA (TERLENGKAP)","reply","U-ZyepruMh0","0"
"@namymv7585","false","Ugy7v0RoplNH2BMmkG54AaABAg.A3gaa-z-juiA3geb-ErrH5","700 an kalau ga salah bang","4843","false","https://www.youtube.com/watch?v=U-ZyepruMh0","4 months ago","0","Ugy7v0RoplNH2BMmkG54AaABAg","STARLINK INDONESIA REVIEW, INTERNET DARI LANGIT TANPA SINYAL DIMANAPUN ANDA BERADA (TERLENGKAP)","reply","U-ZyepruMh0","0"
"@namymv7585","false","Ugy7v0RoplNH2BMmkG54AaABAg.A3gaa-z-juiA3gecpHEFp7","beli alat nya 7 juta 8 juta an","4843","false","https://www.youtube.com/watch?v=U-ZyepruMh0","4 months ago","0","Ugy7v0RoplNH2BMmkG54AaABAg","STARLINK INDONESIA REVIEW, INTERNET DARI LANGIT TANPA SINYAL DIMANAPUN ANDA BERADA (TERLENGKAP)","reply","U-ZyepruMh0","0"
"@khasogi27","false","Ugy7v0RoplNH2BMmkG54AaABAg.A3gaa-z-juiA3hjW69vtvS","Udah turun harganya jadi 4jt an. Info lengkapnya liat di situs resminya starlink","4843","false","https://www.youtube.com/watch?v=U-ZyepruMh0","4 months ago","0","Ugy7v0RoplNH2BMmkG54AaABAg","STARLINK INDONESIA REVIEW, INTERNET DARI LANGIT TANPA SINYAL DIMANAPUN ANDA BERADA (TERLENGKAP)","reply","U-ZyepruMh0","0"
"@qomaruzzamanmustofa7947","false","UgxgpAbfR4y9JkgjdBZ4AaABAg","Kata-kata Anjir diganti aja pakai Masya Allah....padahal yo sarungan lho....","4843","false","https://www.youtube.com/watch?v=U-ZyepruMh0","4 months ago","0",,"STARLINK INDONESIA REVIEW, INTERNET DARI LANGIT TANPA SINYAL DIMANAPUN ANDA BERADA (TERLENGKAP)","comment","U-ZyepruMh0","0"
"@damngallery9267","false","Ugy8p-0UIk1OgPfqRGZ4AaABAg","Mas Nanang, betullkah Starlink Residensial ada FUP Kuota nya ?","4843","false","https://www.youtube.com/watch?v=U-ZyepruMh0","4 months ago","0",,"STARLINK INDONESIA REVIEW, INTERNET DARI LANGIT TANPA SINYAL DIMANAPUN ANDA BERADA (TERLENGKAP)","comment","U-ZyepruMh0","0"
"@thisistrazzo4148","false","UgwLSitcW7qJsGkO7KB4AaABAg","jangan Mbps bang, coba yg MB/S biar jelas","4843","false","https://www.youtube.com/watch?v=U-ZyepruMh0","4 months ago","0",,"STARLINK INDONESIA REVIEW, INTERNET DARI LANGIT TANPA SINYAL DIMANAPUN ANDA BERADA (TERLENGKAP)","comment","U-ZyepruMh0","0"
"@sisisudutpandang","false","UgwSMx3WY6hB_8KqIkh4AaABAg","kalau dipakai bersama, apa ada batasan sampai brp pengguna, soalnya mungkin sangat cocok di pedesaan pegunungan terpencil yang membuthkan akses internet","4843","false","https://www.youtube.com/watch?v=U-ZyepruMh0","4 months ago","0",,"STARLINK INDONESIA REVIEW, INTERNET DARI LANGIT TANPA SINYAL DIMANAPUN ANDA BERADA (TERLENGKAP)","comment","U-ZyepruMh0","0"
"@muhammadnoor2905","false","UgxBwUhp7TfMVs1JKDN4AaABAg","Minta no wa nya bang","4843","false","https://www.youtube.com/watch?v=U-ZyepruMh0","4 months ago","0",,"STARLINK INDONESIA REVIEW, INTERNET DARI LANGIT TANPA SINYAL DIMANAPUN ANDA BERADA (TERLENGKAP)","comment","U-ZyepruMh0","0"
"@TheArdhy007","false","Ugwyk60cZCAZa3v6Ra94AaABAg","Owh.. ternyata ini punya nya elon musk. Pantes kmren dia dateng ke Indo","4843","false","https://www.youtube.com/watch?v=U-ZyepruMh0","4 months ago","0",,"STARLINK INDONESIA REVIEW, INTERNET DARI LANGIT TANPA SINYAL DIMANAPUN ANDA BERADA (TERLENGKAP)","comment","U-ZyepruMh0","0"
"@Sl4m3t","false","UgzgYneb4eo3YWDIf4J4AaABAg","mas saya lihat channel sampean katanya ada stander LAN nya, saya cari gak nemu mas , bisa minta link nya gak saya mau order soalnya
terima kasih","4843","false","https://www.youtube.com/watch?v=U-ZyepruMh0","4 months ago","0",,"STARLINK INDONESIA REVIEW, INTERNET DARI LANGIT TANPA SINYAL DIMANAPUN ANDA BERADA (TERLENGKAP)","comment","U-ZyepruMh0","0"
"@hermanuslandak569","false","UgyZ7979SV7eIXXhcJF4AaABAg","apakah bisa buat usaha voucher ini bg 😁","4843","false","https://www.youtube.com/watch?v=U-ZyepruMh0","4 months ago","0",,"STARLINK INDONESIA REVIEW, INTERNET DARI LANGIT TANPA SINYAL DIMANAPUN ANDA BERADA (TERLENGKAP)","comment","U-ZyepruMh0","0"
"@irfanadisini","false","UgytpzGROukLxzngjUp4AaABAg","Waaaah    yo tutup kabeh ae nuw  routere  ,  putus kabeh no wifine  ,  prei kabeh now paketane     ... 
gawe iki wae   noo   lak an   ...    😅😅😅","4843","false","https://www.youtube.com/watch?v=U-ZyepruMh0","4 months ago","0",,"STARLINK INDONESIA REVIEW, INTERNET DARI LANGIT TANPA SINYAL DIMANAPUN ANDA BERADA (TERLENGKAP)","comment","U-ZyepruMh0","0"
"@superkuktving4996","false","UgzoHzzyOolc2jhQXs14AaABAg","untuk penggunaan usernya dibatasin ga ya ? lumayan ini buat rt rw net seperti jaman dulu masih mungkin ga ya ?","4843","false","https://www.youtube.com/watch?v=U-ZyepruMh0","4 months ago","0",,"STARLINK INDONESIA REVIEW, INTERNET DARI LANGIT TANPA SINYAL DIMANAPUN ANDA BERADA (TERLENGKAP)","comment","U-ZyepruMh0","1"
"@jayjaywoodland","false","UgzHuc_mlHFVGTDFz_54AaABAg","stabilitas koneksinya gimana mas?","4843","false","https://www.youtube.com/watch?v=U-ZyepruMh0","4 months ago","0",,"STARLINK INDONESIA REVIEW, INTERNET DARI LANGIT TANPA SINYAL DIMANAPUN ANDA BERADA (TERLENGKAP)","comment","U-ZyepruMh0","0"
"@barysantoso7110","false","Ugyi-aAHpiQ5exIeXgN4AaABAg","bang, kalau cuaca kurang bagus apa pengaruh?","4843","false","https://www.youtube.com/watch?v=U-ZyepruMh0","4 months ago","0",,"STARLINK INDONESIA REVIEW, INTERNET DARI LANGIT TANPA SINYAL DIMANAPUN ANDA BERADA (TERLENGKAP)","comment","U-ZyepruMh0","0"
"@superkuktving4996","false","UgyW5YW0Uvu1ZtwzT4R4AaABAg","mantapp segera kami proses pembelian","4843","false","https://www.youtube.com/watch?v=U-ZyepruMh0","4 months ago","0",,"STARLINK INDONESIA REVIEW, INTERNET DARI LANGIT TANPA SINYAL DIMANAPUN ANDA BERADA (TERLENGKAP)","comment","U-ZyepruMh0","0"
"@soloriyadi","false","UgzM_Ao-LKkwITfyg4V4AaABAg","ada colokan kabel port rj45 tidak  bang ?","4843","false","https://www.youtube.com/watch?v=U-ZyepruMh0","4 months ago","0",,"STARLINK INDONESIA REVIEW, INTERNET DARI LANGIT TANPA SINYAL DIMANAPUN ANDA BERADA (TERLENGKAP)","comment","U-ZyepruMh0","0"
"@JustFiqri","false","UgwLDqQnRFY7EtFtnwV4AaABAg","Semoga kamajuan ""internet cepat di Indonesia"" segera tercapai, bosen gua tiap hari gangguan terus wifi sama kecepatan nya 50Ks The heck lah 💀","4843","false","https://www.youtube.com/watch?v=U-ZyepruMh0","4 months ago","0",,"STARLINK INDONESIA REVIEW, INTERNET DARI LANGIT TANPA SINYAL DIMANAPUN ANDA BERADA (TERLENGKAP)","comment","U-ZyepruMh0","1"
"@andribatubara1549","false","Ugy5q2i2oSKRAYHs-oJ4AaABAg","akhirnya bisa liat Telkomsel bangkrut","4843","false","https://www.youtube.com/watch?v=U-ZyepruMh0","4 months ago","0",,"STARLINK INDONESIA REVIEW, INTERNET DARI LANGIT TANPA SINYAL DIMANAPUN ANDA BERADA (TERLENGKAP)","comment","U-ZyepruMh0","0"
"@samsidji7805","false","UgwGbC-2pH858z3L0N54AaABAg","Tanpa sinyal ?? Padahal via kabel UTP, kabel optic, satelit atau nirkabel  itu semua untuk menyalurkan signal internet . La pake starlink kok nggak pake signal itu teorinya gimanamase.😊","4843","false","https://www.youtube.com/watch?v=U-ZyepruMh0","4 months ago","0",,"STARLINK INDONESIA REVIEW, INTERNET DARI LANGIT TANPA SINYAL DIMANAPUN ANDA BERADA (TERLENGKAP)","comment","U-ZyepruMh0","0"
"@machadobriady6043","false","Ugy6lKHX5nlwNFBbbNp4AaABAg","mas di pake untuk pindah dari lokasi alamat sekitar 100kilo bisa gak....??","4843","false","https://www.youtube.com/watch?v=U-ZyepruMh0","4 months ago","0",,"STARLINK INDONESIA REVIEW, INTERNET DARI LANGIT TANPA SINYAL DIMANAPUN ANDA BERADA (TERLENGKAP)","comment","U-ZyepruMh0","0"
"@jokowijayanto6217","false","Ugy3dUGa0RWASEdkL354AaABAg","Telkom,biznet, Indosat, FM , MNC vision, ketar-  ketir ada penantang baru internet 🤣","4843","false","https://www.youtube.com/watch?v=U-ZyepruMh0","4 months ago","0",,"STARLINK INDONESIA REVIEW, INTERNET DARI LANGIT TANPA SINYAL DIMANAPUN ANDA BERADA (TERLENGKAP)","comment","U-ZyepruMh0","0"
"@PojiEste","false","UgzsKUfRFjVRaoPOH6R4AaABAg","Mas sekarang bkin tutorial konekin ke mikrotik","4843","false","https://www.youtube.com/watch?v=U-ZyepruMh0","4 months ago","0",,"STARLINK INDONESIA REVIEW, INTERNET DARI LANGIT TANPA SINYAL DIMANAPUN ANDA BERADA (TERLENGKAP)","comment","U-ZyepruMh0","0"
"@Genkai512","false","UgzQsstY4LQZFFZrDKd4AaABAg","Indihome be like : mungkin sudah saatnya pensiun..","4843","false","https://www.youtube.com/watch?v=U-ZyepruMh0","4 months ago","0",,"STARLINK INDONESIA REVIEW, INTERNET DARI LANGIT TANPA SINYAL DIMANAPUN ANDA BERADA (TERLENGKAP)","comment","U-ZyepruMh0","0"
"@JejakDigitalKU","false","UgzYHYjBCk1-lYgcE814AaABAg","Info di website, untuk harga bulanan paket bisnis standar Rp 1.100.000 hanya dapat 40Gb. Kalau yang personal tidak ada info FUP-nya, tapi logikanya paket bisnis biasanya di atas personal.

Apa sudah tes sampai penggunaan banyak om (lehib 40Gb)?","4843","false","https://www.youtube.com/watch?v=U-ZyepruMh0","4 months ago","0",,"STARLINK INDONESIA REVIEW, INTERNET DARI LANGIT TANPA SINYAL DIMANAPUN ANDA BERADA (TERLENGKAP)","comment","U-ZyepruMh0","0"
"@wahyulp8406","false","UgxxwA1DN0hDrMa2ROR4AaABAg","Pinter banget elon musk merampok uang orang indo ya. Padahal termasuk layanan yang mahal.","4843","false","https://www.youtube.com/watch?v=U-ZyepruMh0","4 months ago","1",,"STARLINK INDONESIA REVIEW, INTERNET DARI LANGIT TANPA SINYAL DIMANAPUN ANDA BERADA (TERLENGKAP)","comment","U-ZyepruMh0","0"
"@kakankafidzchannel5728","false","UgzV1uMdptA_ftTnCzB4AaABAg","mas nanang , itu ada port LAN nya gak?","4843","false","https://www.youtube.com/watch?v=U-ZyepruMh0","4 months ago","0",,"STARLINK INDONESIA REVIEW, INTERNET DARI LANGIT TANPA SINYAL DIMANAPUN ANDA BERADA (TERLENGKAP)","comment","U-ZyepruMh0","0"
"@gustimadekatabi613","false","UgxN_RO6y1puCrxRIqV4AaABAg","Apakah ada biaya langganan nya lagi kah? Kepoin donk","4843","false","https://www.youtube.com/watch?v=U-ZyepruMh0","4 months ago","0",,"STARLINK INDONESIA REVIEW, INTERNET DARI LANGIT TANPA SINYAL DIMANAPUN ANDA BERADA (TERLENGKAP)","comment","U-ZyepruMh0","0"
"@permatamarmer1366","false","UgzVpb1nMWNrMOAlBf14AaABAg","WiFi bentar lagi ga laku, hhh","4843","false","https://www.youtube.com/watch?v=U-ZyepruMh0","4 months ago","0",,"STARLINK INDONESIA REVIEW, INTERNET DARI LANGIT TANPA SINYAL DIMANAPUN ANDA BERADA (TERLENGKAP)","comment","U-ZyepruMh0","0"
"@lmp_88","false","Ugx6x5dpkQEOiLjt-F14AaABAg","mas congore koncomu klihatan membesar apa pngaruh starlink 😅","4843","false","https://www.youtube.com/watch?v=U-ZyepruMh0","4 months ago","0",,"STARLINK INDONESIA REVIEW, INTERNET DARI LANGIT TANPA SINYAL DIMANAPUN ANDA BERADA (TERLENGKAP)","comment","U-ZyepruMh0","0"
"@dimostos","false","UgyPli6LXaL1TZk69Yl4AaABAg","bang kalau STARLINK itu kalau di tempat pegunungan yang susah sinyal bagaimana bang?","4843","false","https://www.youtube.com/watch?v=U-ZyepruMh0","4 months ago","1",,"STARLINK INDONESIA REVIEW, INTERNET DARI LANGIT TANPA SINYAL DIMANAPUN ANDA BERADA (TERLENGKAP)","comment","U-ZyepruMh0","0"
"@jerukpedas","false","UgwEcjw9gm7vdemgmV94AaABAg","Sekarang lagi diskon cuyy 4 juta","4843","false","https://www.youtube.com/watch?v=U-ZyepruMh0","4 months ago","0",,"STARLINK INDONESIA REVIEW, INTERNET DARI LANGIT TANPA SINYAL DIMANAPUN ANDA BERADA (TERLENGKAP)","comment","U-ZyepruMh0","1"
"@marningotmanurung4435","false","UgxVYui77EwLnuIrMlR4AaABAg","apakah kecepatan sinyal Tdk bisa mendekati kecepatan cahaya...???","4843","false","https://www.youtube.com/watch?v=U-ZyepruMh0","4 months ago","0",,"STARLINK INDONESIA REVIEW, INTERNET DARI LANGIT TANPA SINYAL DIMANAPUN ANDA BERADA (TERLENGKAP)","comment","U-ZyepruMh0","0"
"@AgusRey-e2e","false","UgzLBNJ5-tpLZGINPZx4AaABAg","Gmn cara berlangganan.","4843","false","https://www.youtube.com/watch?v=U-ZyepruMh0","4 months ago","0",,"STARLINK INDONESIA REVIEW, INTERNET DARI LANGIT TANPA SINYAL DIMANAPUN ANDA BERADA (TERLENGKAP)","comment","U-ZyepruMh0","0"
"@harismunandar3037","false","UgyGhd4_dyzxGAtn8M94AaABAg","Makin mahal biaya internetannya bagi masyarakat sipil🏳","4843","false","https://www.youtube.com/watch?v=U-ZyepruMh0","4 months ago","0",,"STARLINK INDONESIA REVIEW, INTERNET DARI LANGIT TANPA SINYAL DIMANAPUN ANDA BERADA (TERLENGKAP)","comment","U-ZyepruMh0","0"
"@mumucahha","false","UgyOChTCH43RBMbqn8J4AaABAg","Menarik. Tapi apa parabolanya harus ditaruh luar? Hujan gimana tuh? Gakk nyetrum kan konek ke listrik tuh","4843","false","https://www.youtube.com/watch?v=U-ZyepruMh0","4 months ago","0",,"STARLINK INDONESIA REVIEW, INTERNET DARI LANGIT TANPA SINYAL DIMANAPUN ANDA BERADA (TERLENGKAP)","comment","U-ZyepruMh0","0"
