"author","authorIsChannelOwner","cid","comment","commentsCount","hasCreatorHeart","pageUrl","publishedTimeText","replyCount","replyToCid","title","type","videoId","voteCount"
"@pejuanghiduplebihbaik6314","false","UgyJfNefb6qZHpC10cx4AaABAg","Bagaimana jika kita ke kantor, apa alatnya hrs dibawa kemana?","4843","false","https://www.youtube.com/watch?v=U-ZyepruMh0","4 months ago","0",,"STARLINK INDONESIA REVIEW, INTERNET DARI LANGIT TANPA SINYAL DIMANAPUN ANDA BERADA (TERLENGKAP)","comment","U-ZyepruMh0","0"
"@sukarmancs868","false","Ugw_LfqB6MszFVI7FgR4AaABAg","Anda seperti pecundang orang yg mendewakan prodak liar ,orang jiqa kerdil ,klo saya sebagus apa pun klo aku tak penting ,yg penting kerja dapat duit kita klo pingin beli apapun yg produk kita sendiri","4843","false","https://www.youtube.com/watch?v=U-ZyepruMh0","4 months ago","0",,"STARLINK INDONESIA REVIEW, INTERNET DARI LANGIT TANPA SINYAL DIMANAPUN ANDA BERADA (TERLENGKAP)","comment","U-ZyepruMh0","0"
"@Rudyanto-us4oe","false","UgyZd2HVqg4jPAESuyx4AaABAg","Ditunggu video starlink selanjutnya, mas Nanang","4843","false","https://www.youtube.com/watch?v=U-ZyepruMh0","4 months ago","0",,"STARLINK INDONESIA REVIEW, INTERNET DARI LANGIT TANPA SINYAL DIMANAPUN ANDA BERADA (TERLENGKAP)","comment","U-ZyepruMh0","0"
"@IniDildo","false","Ugym0hI3M7wRAqUWEWd4AaABAg","Yang bilang mahal, yaudah gausah beli😂 ada harga ada kualitas","4843","false","https://www.youtube.com/watch?v=U-ZyepruMh0","4 months ago","0",,"STARLINK INDONESIA REVIEW, INTERNET DARI LANGIT TANPA SINYAL DIMANAPUN ANDA BERADA (TERLENGKAP)","comment","U-ZyepruMh0","0"
"@galaxybimasakti8400","false","UgwRs4BEllyManS0OBp4AaABAg","Kesombongan sistem homepass pada isp akan terhancurkan oleh starlink","4843","false","https://www.youtube.com/watch?v=U-ZyepruMh0","4 months ago","0",,"STARLINK INDONESIA REVIEW, INTERNET DARI LANGIT TANPA SINYAL DIMANAPUN ANDA BERADA (TERLENGKAP)","comment","U-ZyepruMh0","0"
"@saktius4188","false","UgyuHPmzT9GHkOQ6iGx4AaABAg","Harga di website sudah termasuk bea cukai Indonesia belum ya ?","4843","false","https://www.youtube.com/watch?v=U-ZyepruMh0","4 months ago","0",,"STARLINK INDONESIA REVIEW, INTERNET DARI LANGIT TANPA SINYAL DIMANAPUN ANDA BERADA (TERLENGKAP)","comment","U-ZyepruMh0","0"
"@suaditebing4403","false","Ugy3yevYOYeCQeme9xd4AaABAg","bisa pakai berapa hp bos","4843","false","https://www.youtube.com/watch?v=U-ZyepruMh0","4 months ago","0",,"STARLINK INDONESIA REVIEW, INTERNET DARI LANGIT TANPA SINYAL DIMANAPUN ANDA BERADA (TERLENGKAP)","comment","U-ZyepruMh0","0"
"@Agus-gt6lx","false","UgwZZKPQzu5irTLqL_V4AaABAg","ini harus diluar rumah ya? apa bisa d taruh d dalam rumah?","4843","false","https://www.youtube.com/watch?v=U-ZyepruMh0","4 months ago","0",,"STARLINK INDONESIA REVIEW, INTERNET DARI LANGIT TANPA SINYAL DIMANAPUN ANDA BERADA (TERLENGKAP)","comment","U-ZyepruMh0","0"
"@adambagushabibiealrasyid","false","Ugx523A4IWGhN3P3Do14AaABAg","Bang mau nanya ada jual mount starlink nya yang murah gak ya bang ?","4843","false","https://www.youtube.com/watch?v=U-ZyepruMh0","4 months ago","0",,"STARLINK INDONESIA REVIEW, INTERNET DARI LANGIT TANPA SINYAL DIMANAPUN ANDA BERADA (TERLENGKAP)","comment","U-ZyepruMh0","0"
"@faisalinanu5358","false","Ugxgo-9vQUvbXkjPn_V4AaABAg","Mas bisa di gunakan untuk berapa hp atau tv di rumah..","4843","false","https://www.youtube.com/watch?v=U-ZyepruMh0","4 months ago","0",,"STARLINK INDONESIA REVIEW, INTERNET DARI LANGIT TANPA SINYAL DIMANAPUN ANDA BERADA (TERLENGKAP)","comment","U-ZyepruMh0","0"
"@ancesalenussa9877","false","UgwIN0LB9V_VfFKJxf94AaABAg","Telkomsel harus bekerja keras, berinovasi dan fasilitasi daerah terpencil agar  pelanggannya tidak beralih ke STARLINK.","4843","false","https://www.youtube.com/watch?v=U-ZyepruMh0","4 months ago (edited)","0",,"STARLINK INDONESIA REVIEW, INTERNET DARI LANGIT TANPA SINYAL DIMANAPUN ANDA BERADA (TERLENGKAP)","comment","U-ZyepruMh0","0"
"@filmlebongnge","false","Ugyu63kqC5Q1ILd560V4AaABAg","Serius nanya, bagaimana mekanisme pembayaran stsrlink, apakah bulan depan nya boleh berhenti 1 bulan trus bukan Depannya lanjut Lagi, atau wajib langganan setiap bulan?
Bagaimana jika telat bayar biaya bulanan?
Mohon di Jawab makasih","4843","false","https://www.youtube.com/watch?v=U-ZyepruMh0","4 months ago","0",,"STARLINK INDONESIA REVIEW, INTERNET DARI LANGIT TANPA SINYAL DIMANAPUN ANDA BERADA (TERLENGKAP)","comment","U-ZyepruMh0","1"
"@PlasticDoor141","false","UgxCClPHJQAWPQFi4_x4AaABAg","Auto ganti ke starlink smpe pda punah semua yg lokal org msih ada brand lokal lain","4843","false","https://www.youtube.com/watch?v=U-ZyepruMh0","4 months ago","0",,"STARLINK INDONESIA REVIEW, INTERNET DARI LANGIT TANPA SINYAL DIMANAPUN ANDA BERADA (TERLENGKAP)","comment","U-ZyepruMh0","0"
"@ProjectPasuruan","false","UgxNyZ1W32u1F3wF5Zp4AaABAg","Ketololan internet di negeri ini adalah pelitnya speed. Secara logika layanan satelit akan lebih rendah dibanding FO, tapi kenapa dengan speed yang sama harganya jauh lebih murah yg pakai satelit ya","4843","false","https://www.youtube.com/watch?v=U-ZyepruMh0","4 months ago","0",,"STARLINK INDONESIA REVIEW, INTERNET DARI LANGIT TANPA SINYAL DIMANAPUN ANDA BERADA (TERLENGKAP)","comment","U-ZyepruMh0","0"
"@darrenthunt582","false","UgzwadljaUxJn9j3oZh4AaABAg","Mas, jika pindah lokasi, mudik beda propinsi misalnya, starlink masih bisa dipake mas?","4843","false","https://www.youtube.com/watch?v=U-ZyepruMh0","4 months ago","1",,"STARLINK INDONESIA REVIEW, INTERNET DARI LANGIT TANPA SINYAL DIMANAPUN ANDA BERADA (TERLENGKAP)","comment","U-ZyepruMh0","0"
"@hamditsani6746","false","UgxWHRn3UtL_u_hz-8Z4AaABAg","Minimal berapa device","4843","false","https://www.youtube.com/watch?v=U-ZyepruMh0","4 months ago","0",,"STARLINK INDONESIA REVIEW, INTERNET DARI LANGIT TANPA SINYAL DIMANAPUN ANDA BERADA (TERLENGKAP)","comment","U-ZyepruMh0","0"
"@_ams5122","false","UgyS0W6YEvsEv8ZpJLJ4AaABAg","Starlink bisa di gunakan berapa banyak user ??","4843","false","https://www.youtube.com/watch?v=U-ZyepruMh0","4 months ago","0",,"STARLINK INDONESIA REVIEW, INTERNET DARI LANGIT TANPA SINYAL DIMANAPUN ANDA BERADA (TERLENGKAP)","comment","U-ZyepruMh0","0"
"@yudiansyah9007","false","Ugy8WZY6cAx_VtveYLB4AaABAg","Bang.. batas maksimun pengguna/konek ke starlink dengan paket resedensial brpa yah ?","4843","false","https://www.youtube.com/watch?v=U-ZyepruMh0","4 months ago","0",,"STARLINK INDONESIA REVIEW, INTERNET DARI LANGIT TANPA SINYAL DIMANAPUN ANDA BERADA (TERLENGKAP)","comment","U-ZyepruMh0","0"
"@pakmussaja","false","UgyK98y8DXl_gdagt-x4AaABAg","Starlink Bisa di sambung ke Mikrotik??","4843","false","https://www.youtube.com/watch?v=U-ZyepruMh0","4 months ago","0",,"STARLINK INDONESIA REVIEW, INTERNET DARI LANGIT TANPA SINYAL DIMANAPUN ANDA BERADA (TERLENGKAP)","comment","U-ZyepruMh0","0"
"@bramlameng3518","false","UgzjS5fhl4gMEUXA9u14AaABAg","Maaf ijin bertanya.. Paket yg murah 750 / bulan, ini maksimal brp pengguna? Kalo mau di pasang di lingkungan sekolah, yg gunakan bisa sampe 100 org, apakah tetap stabil atau gmna? Krn paket yg lain jg gak dijelaskan maximal jumlah penggunanya 🙏🙏","4843","false","https://www.youtube.com/watch?v=U-ZyepruMh0","4 months ago","0",,"STARLINK INDONESIA REVIEW, INTERNET DARI LANGIT TANPA SINYAL DIMANAPUN ANDA BERADA (TERLENGKAP)","comment","U-ZyepruMh0","0"
"@SugarBae-en2jy","false","UgyQpbuTal8Z4JfXNt54AaABAg","Bang bisa sampe brp device starlink biar aman?","4843","false","https://www.youtube.com/watch?v=U-ZyepruMh0","4 months ago","0",,"STARLINK INDONESIA REVIEW, INTERNET DARI LANGIT TANPA SINYAL DIMANAPUN ANDA BERADA (TERLENGKAP)","comment","U-ZyepruMh0","0"
"@anggambltsolo276","false","Ugx_XGi5qwQRFgeqJGZ4AaABAg","Sebulan berarti bayar 700+ ya bang lenggananya. Kalau sebulan segitu ya wajar sih. Skrang yg internet 350-400 aja udh lancar2.","4843","false","https://www.youtube.com/watch?v=U-ZyepruMh0","4 months ago","0",,"STARLINK INDONESIA REVIEW, INTERNET DARI LANGIT TANPA SINYAL DIMANAPUN ANDA BERADA (TERLENGKAP)","comment","U-ZyepruMh0","0"
"@harimulyana112","false","UgzdB5o0VoAUxAw-4np4AaABAg","Bang tutorial nya cara mematikannya starlinknya yg aman seperti apa?","4843","false","https://www.youtube.com/watch?v=U-ZyepruMh0","4 months ago","0",,"STARLINK INDONESIA REVIEW, INTERNET DARI LANGIT TANPA SINYAL DIMANAPUN ANDA BERADA (TERLENGKAP)","comment","U-ZyepruMh0","0"
"@BinatangAja","false","UgzwadljaUxJn9j3oZh4AaABAg.A4OogKQkJVAA4PJ3Y2af7O","Bisa dimana aja seluruh indonesia","4843","false","https://www.youtube.com/watch?v=U-ZyepruMh0","4 months ago (edited)","0","UgzwadljaUxJn9j3oZh4AaABAg","STARLINK INDONESIA REVIEW, INTERNET DARI LANGIT TANPA SINYAL DIMANAPUN ANDA BERADA (TERLENGKAP)","reply","U-ZyepruMh0","0"
"@rendy3422","false","UgzxOLok0bF1iI03y6V4AaABAg","Klo udh pesan paket promo yg 4,6juta & langganan yg paket Residensial. Apakah bisa mengubah paket Layanan dari Residensial ke Bisnis ?

Rencana mau pesan Starlink untuk kantor, tp mau beli yg promo 4,6jt. Ntar bulanananya paket yg Bisnis 1,1jt.

Mohon bantuannya, makasih. 🙏🏻","4843","false","https://www.youtube.com/watch?v=U-ZyepruMh0","4 months ago","0",,"STARLINK INDONESIA REVIEW, INTERNET DARI LANGIT TANPA SINYAL DIMANAPUN ANDA BERADA (TERLENGKAP)","comment","U-ZyepruMh0","0"
"@ramaerlangga236","false","UgzPL5SXnfab4j31GiJ4AaABAg","Bikin Ngilerrrr Starlink, pengen coba' in sinyal superrr canggihh...!!🤤👍🏻🔌📱","4843","false","https://www.youtube.com/watch?v=U-ZyepruMh0","4 months ago","0",,"STARLINK INDONESIA REVIEW, INTERNET DARI LANGIT TANPA SINYAL DIMANAPUN ANDA BERADA (TERLENGKAP)","comment","U-ZyepruMh0","0"
"@aprianussilamba67","false","UgzLg2hULrE1SlwqOGF4AaABAg","Di wilayah kami blum melayani pengiriman 

Kalau kirim ke tempat lain baru kita bawa ke tempat sya bisa Ndak yaa","4843","false","https://www.youtube.com/watch?v=U-ZyepruMh0","4 months ago","0",,"STARLINK INDONESIA REVIEW, INTERNET DARI LANGIT TANPA SINYAL DIMANAPUN ANDA BERADA (TERLENGKAP)","comment","U-ZyepruMh0","0"
"@lindandriyana","false","UgzEJ9T-g_IsTgFNp9B4AaABAg","Jangkauan jaringan nya smpe brp meter/km pak kalau utk perumahan?","4843","false","https://www.youtube.com/watch?v=U-ZyepruMh0","4 months ago","0",,"STARLINK INDONESIA REVIEW, INTERNET DARI LANGIT TANPA SINYAL DIMANAPUN ANDA BERADA (TERLENGKAP)","comment","U-ZyepruMh0","0"
"@kliprahman3008","false","Ugz7b6vlbA3yEUgiJj94AaABAg","Menuju 1jt views. Gedgetins efek 🔥🔥","4843","false","https://www.youtube.com/watch?v=U-ZyepruMh0","4 months ago","0",,"STARLINK INDONESIA REVIEW, INTERNET DARI LANGIT TANPA SINYAL DIMANAPUN ANDA BERADA (TERLENGKAP)","comment","U-ZyepruMh0","0"
"@bubiimut","false","UgzAeGpJMpWKzW-Wc_p4AaABAg","Maksimal berapa device bang?","4843","false","https://www.youtube.com/watch?v=U-ZyepruMh0","4 months ago","0",,"STARLINK INDONESIA REVIEW, INTERNET DARI LANGIT TANPA SINYAL DIMANAPUN ANDA BERADA (TERLENGKAP)","comment","U-ZyepruMh0","0"
"@yakhinhermontandiallo5634","false","UgwXcAZz4_qSPg5z7914AaABAg","Selamat tinggal Telkomsel","4843","false","https://www.youtube.com/watch?v=U-ZyepruMh0","4 months ago","0",,"STARLINK INDONESIA REVIEW, INTERNET DARI LANGIT TANPA SINYAL DIMANAPUN ANDA BERADA (TERLENGKAP)","comment","U-ZyepruMh0","0"
"@akbarlatif-2616","false","UgzjHtNJ8F891Hw4CVd4AaABAg","Maksimal berapa perangkat yg bisa terhubung klo paket 750k/bln","4843","false","https://www.youtube.com/watch?v=U-ZyepruMh0","4 months ago","0",,"STARLINK INDONESIA REVIEW, INTERNET DARI LANGIT TANPA SINYAL DIMANAPUN ANDA BERADA (TERLENGKAP)","comment","U-ZyepruMh0","0"
"@rintoanggoro4472","false","Ugw8dbrdtSHvXK2oIFl4AaABAg","Perbulan nya mahal gaes","4843","false","https://www.youtube.com/watch?v=U-ZyepruMh0","4 months ago","0",,"STARLINK INDONESIA REVIEW, INTERNET DARI LANGIT TANPA SINYAL DIMANAPUN ANDA BERADA (TERLENGKAP)","comment","U-ZyepruMh0","0"
"@kaisaralifsparta3989","false","UgyrhHFwIThLqdI8C8l4AaABAg","Ayo Telkomsel Indonesia. Ini tantangan untuk kalian saingan Baru. Datang. Starlink internet dari langit. Ngebut banget.
Apakah Telkomsel Indonesia bisa menjadi terdepan. Kita lihat saja nanti.","4843","false","https://www.youtube.com/watch?v=U-ZyepruMh0","4 months ago (edited)","0",,"STARLINK INDONESIA REVIEW, INTERNET DARI LANGIT TANPA SINYAL DIMANAPUN ANDA BERADA (TERLENGKAP)","comment","U-ZyepruMh0","0"
"@Unggas222","false","UgzJZuRicAcLfUa0Kt14AaABAg","Starting semakin canggih tapi semakin mahal","4843","false","https://www.youtube.com/watch?v=U-ZyepruMh0","4 months ago","0",,"STARLINK INDONESIA REVIEW, INTERNET DARI LANGIT TANPA SINYAL DIMANAPUN ANDA BERADA (TERLENGKAP)","comment","U-ZyepruMh0","0"
"@martuaps1964","false","UgyIlEoOEKwUaBLa1H54AaABAg","utk para gamers agar perhatikan juga ""latency"" starlink (jgn hanya lihat speed aja) krn bila latency tinggi maka kecepatan aksi atau waktu respon menjd lambat/tertunda","4843","false","https://www.youtube.com/watch?v=U-ZyepruMh0","4 months ago","0",,"STARLINK INDONESIA REVIEW, INTERNET DARI LANGIT TANPA SINYAL DIMANAPUN ANDA BERADA (TERLENGKAP)","comment","U-ZyepruMh0","0"
"@topan-o3p","false","UgzhypM5jMSmwEkngmJ4AaABAg","Jadi Makin Betah dong starlink bikin jadi hoki terus tiap hari buat kuliah dan bisa di pakai ke pelosok indonesia yang terpencil, dan kalau buat Hiburan Nonton film sama Main Game Online Jadi Makin Super Ngebut, mksih kak infonya, Mksih buat Kakak Elon Mask succes selalu buat Kakak Elon Mask yg sudah ciptakan Internet yang Simple dan Gak Ribet di tahun 2024. Chayooo","4843","false","https://www.youtube.com/watch?v=U-ZyepruMh0","4 months ago","0",,"STARLINK INDONESIA REVIEW, INTERNET DARI LANGIT TANPA SINYAL DIMANAPUN ANDA BERADA (TERLENGKAP)","comment","U-ZyepruMh0","0"
"@fahrudindjarod12","false","UgzEFSVPpg58ONR-snJ4AaABAg","Itu bisa dibawa kemana""ya bearti . / harga 750 udah gk pilih paket inet lagi kah","4843","false","https://www.youtube.com/watch?v=U-ZyepruMh0","4 months ago","0",,"STARLINK INDONESIA REVIEW, INTERNET DARI LANGIT TANPA SINYAL DIMANAPUN ANDA BERADA (TERLENGKAP)","comment","U-ZyepruMh0","0"
"@ittamm3818","false","Ugw_r5Dy0xf_Cpsd4Bh4AaABAg","Maaf nih bang,, lu tau kan si elon musk mendukung israel setelah kunjungannya di israel, dan memberi akses internet kepada para tentara mereka dan tanpa memedulikan rakyat palestina,, bisa gk sebagai sesama saudara seiman anda banned dulu produknya? 🙏,, yang kami lakukan untuk membanned mereka, jadinya gk sia2 🙏","4843","false","https://www.youtube.com/watch?v=U-ZyepruMh0","4 months ago","0",,"STARLINK INDONESIA REVIEW, INTERNET DARI LANGIT TANPA SINYAL DIMANAPUN ANDA BERADA (TERLENGKAP)","comment","U-ZyepruMh0","0"
"@aelb9208","false","UgzPLyitog_DyNJ4QdZ4AaABAg","bisa nyambung berapa device mas?","4843","false","https://www.youtube.com/watch?v=U-ZyepruMh0","4 months ago","0",,"STARLINK INDONESIA REVIEW, INTERNET DARI LANGIT TANPA SINYAL DIMANAPUN ANDA BERADA (TERLENGKAP)","comment","U-ZyepruMh0","0"
"@muhamadbalkan8155","false","Ugz0jaOoInuW2op1gYV4AaABAg","bang untuk package yang residental itu maksimal brpa device yang bisa konek ?","4843","false","https://www.youtube.com/watch?v=U-ZyepruMh0","4 months ago","0",,"STARLINK INDONESIA REVIEW, INTERNET DARI LANGIT TANPA SINYAL DIMANAPUN ANDA BERADA (TERLENGKAP)","comment","U-ZyepruMh0","0"
"@abdulhakim4591","false","UgxVN0T5YCoJh-Qjs8F4AaABAg","Assalamualaikum wr wb, harga berapa mas?","4843","false","https://www.youtube.com/watch?v=U-ZyepruMh0","4 months ago","0",,"STARLINK INDONESIA REVIEW, INTERNET DARI LANGIT TANPA SINYAL DIMANAPUN ANDA BERADA (TERLENGKAP)","comment","U-ZyepruMh0","0"
"@suyonohermawan9532","false","UgyZe_4hu_a8Fzvm9jZ4AaABAg","Buat kaum mendang mending lebih cocok pake voucher internet 😢","4843","false","https://www.youtube.com/watch?v=U-ZyepruMh0","4 months ago","0",,"STARLINK INDONESIA REVIEW, INTERNET DARI LANGIT TANPA SINYAL DIMANAPUN ANDA BERADA (TERLENGKAP)","comment","U-ZyepruMh0","0"
"@indihomeklaten.channel3491","false","UgzDTkLGh-m4z3rMoH14AaABAg","Cuaca Buruk aman nggak kakk Mau nyoba ne bikin network backbone  di Desa desa terpencil","4843","false","https://www.youtube.com/watch?v=U-ZyepruMh0","4 months ago","0",,"STARLINK INDONESIA REVIEW, INTERNET DARI LANGIT TANPA SINYAL DIMANAPUN ANDA BERADA (TERLENGKAP)","comment","U-ZyepruMh0","0"
"@alfinsusalfinsus1011","false","Ugw2kPEy1Hmdv4CEyUR4AaABAg","Kalau sama sekali tidak ada sinyal bisa GK bang","4843","false","https://www.youtube.com/watch?v=U-ZyepruMh0","4 months ago","0",,"STARLINK INDONESIA REVIEW, INTERNET DARI LANGIT TANPA SINYAL DIMANAPUN ANDA BERADA (TERLENGKAP)","comment","U-ZyepruMh0","0"
"@yohanisjaya4413","false","UgzIG1O_AhqRolLv47l4AaABAg","Kalau yg gak Ade sgnal benar gmna bos...","4843","false","https://www.youtube.com/watch?v=U-ZyepruMh0","4 months ago","0",,"STARLINK INDONESIA REVIEW, INTERNET DARI LANGIT TANPA SINYAL DIMANAPUN ANDA BERADA (TERLENGKAP)","comment","U-ZyepruMh0","0"
"@KarimudinTukan","false","UgxJ46eep9gFRgLHjxd4AaABAg","Assalamualaikum
Bang bisa bantu pesan bang?","4843","false","https://www.youtube.com/watch?v=U-ZyepruMh0","4 months ago","0",,"STARLINK INDONESIA REVIEW, INTERNET DARI LANGIT TANPA SINYAL DIMANAPUN ANDA BERADA (TERLENGKAP)","comment","U-ZyepruMh0","0"
"@AlfanaTiadi","false","UgxZxAu1gIrf9-BtbCZ4AaABAg","Berapa hp yaaa","4843","false","https://www.youtube.com/watch?v=U-ZyepruMh0","4 months ago","0",,"STARLINK INDONESIA REVIEW, INTERNET DARI LANGIT TANPA SINYAL DIMANAPUN ANDA BERADA (TERLENGKAP)","comment","U-ZyepruMh0","0"
"@YeniHeri-ol1in","false","Ugz12dvAvuiR3X7i19p4AaABAg","Mash enak indihome 😂😂😂😂😂😂😂","4843","false","https://www.youtube.com/watch?v=U-ZyepruMh0","4 months ago","0",,"STARLINK INDONESIA REVIEW, INTERNET DARI LANGIT TANPA SINYAL DIMANAPUN ANDA BERADA (TERLENGKAP)","comment","U-ZyepruMh0","0"
"@Satria-N","false","UgyqfG2QOmylgBIRm0J4AaABAg","Bagus untuk membuat penyedia internet Indonesia  yang rakus pulsa rakus kuota dan uang puyeng","4843","false","https://www.youtube.com/watch?v=U-ZyepruMh0","4 months ago (edited)","0",,"STARLINK INDONESIA REVIEW, INTERNET DARI LANGIT TANPA SINYAL DIMANAPUN ANDA BERADA (TERLENGKAP)","comment","U-ZyepruMh0","0"
"@daykreatif5795","false","UgzcRdK5l2tx1Kn39pl4AaABAg","👍👍👍","4843","false","https://www.youtube.com/watch?v=U-ZyepruMh0","4 months ago","0",,"STARLINK INDONESIA REVIEW, INTERNET DARI LANGIT TANPA SINYAL DIMANAPUN ANDA BERADA (TERLENGKAP)","comment","U-ZyepruMh0","0"
"@TataMiarta","false","UgwLdWFNKuQz4ptSwVV4AaABAg","Bang gw beli tapi posisi saya di Taiwan itu kalo ga di pake selama 3 tahunan  rusak ga? atau bisa digunakan nanti² nya","4843","false","https://www.youtube.com/watch?v=U-ZyepruMh0","4 months ago","0",,"STARLINK INDONESIA REVIEW, INTERNET DARI LANGIT TANPA SINYAL DIMANAPUN ANDA BERADA (TERLENGKAP)","comment","U-ZyepruMh0","0"
"@TataMiarta","false","UgzRGDda8f8VdVvRr6V4AaABAg","Kalau buat kafe atau warkop² boleh ga penggunanya banyak tapi ga di jual voceran","4843","false","https://www.youtube.com/watch?v=U-ZyepruMh0","4 months ago","1",,"STARLINK INDONESIA REVIEW, INTERNET DARI LANGIT TANPA SINYAL DIMANAPUN ANDA BERADA (TERLENGKAP)","comment","U-ZyepruMh0","0"
"@ApaAjaBoleh..","false","UgzpdJ_B6PFGiMQabut4AaABAg","Pantes sinyal kartu mobile jadi jelek","4843","false","https://www.youtube.com/watch?v=U-ZyepruMh0","4 months ago","0",,"STARLINK INDONESIA REVIEW, INTERNET DARI LANGIT TANPA SINYAL DIMANAPUN ANDA BERADA (TERLENGKAP)","comment","U-ZyepruMh0","0"
"@dahyaniabdillah6647","false","UgwE7YO37IPNIHFZhUp4AaABAg","Apakah bisa di pancarkan ke rumah2 tetangga ya..klau bisa kan lumayan bisa menghasilkan uang boss","4843","false","https://www.youtube.com/watch?v=U-ZyepruMh0","4 months ago","0",,"STARLINK INDONESIA REVIEW, INTERNET DARI LANGIT TANPA SINYAL DIMANAPUN ANDA BERADA (TERLENGKAP)","comment","U-ZyepruMh0","0"
"@justuarebruno9943","false","UgyfG1W16prBvABaXmJ4AaABAg","Kalo desa terpencil yg gaada listrik. Sama aja yaaaa😢","4843","false","https://www.youtube.com/watch?v=U-ZyepruMh0","4 months ago","0",,"STARLINK INDONESIA REVIEW, INTERNET DARI LANGIT TANPA SINYAL DIMANAPUN ANDA BERADA (TERLENGKAP)","comment","U-ZyepruMh0","0"
"@waiyudi7715","false","Ugw6M0pC6I5Da0E11-14AaABAg","Bang
Di apk starlingnya ada gak fitur untuk memblokir pengguna lain,yg menggunakan wifi starling kita","4843","false","https://www.youtube.com/watch?v=U-ZyepruMh0","4 months ago","0",,"STARLINK INDONESIA REVIEW, INTERNET DARI LANGIT TANPA SINYAL DIMANAPUN ANDA BERADA (TERLENGKAP)","comment","U-ZyepruMh0","0"
"@alexturner6476","false","UgyIV6GyBft6FG5kg7R4AaABAg","baru mampir kesini, intinya jangan fomo buat kalian yg ter-starlink starlink. kalo rumah kalian dikota besar yg terjangkau berbagai macam provider internet kabel/fiber, mending pasang fiber aja. tapi kalo daerah kalian memang susah/gak ada pilihan internet kabel ya gpplah nyobain starlink. sekali lagi jangan fomo ya teman teman harganya gak murah soalnya, tapi kalo anda kaya raya 7 turunan ya gak masalah buat coba2🙏😁","4843","false","https://www.youtube.com/watch?v=U-ZyepruMh0","4 months ago","0",,"STARLINK INDONESIA REVIEW, INTERNET DARI LANGIT TANPA SINYAL DIMANAPUN ANDA BERADA (TERLENGKAP)","comment","U-ZyepruMh0","0"
"@cendolchannel4044","false","UgylaZrDB08I6E3kvJh4AaABAg","Pacarmu selingkuh mas 😂😂","4843","false","https://www.youtube.com/watch?v=U-ZyepruMh0","4 months ago","0",,"STARLINK INDONESIA REVIEW, INTERNET DARI LANGIT TANPA SINYAL DIMANAPUN ANDA BERADA (TERLENGKAP)","comment","U-ZyepruMh0","0"
"@bppsinjaiborong8633","false","Ugz1OeRMxHwg2DSOd9Z4AaABAg","Hanya saja kalau kita pake produk Amerika selalu terancam boikot, sepertinya China lebih bisa dipercaya daripada Amerika","4843","false","https://www.youtube.com/watch?v=U-ZyepruMh0","4 months ago","0",,"STARLINK INDONESIA REVIEW, INTERNET DARI LANGIT TANPA SINYAL DIMANAPUN ANDA BERADA (TERLENGKAP)","comment","U-ZyepruMh0","0"
"@muhamadikbalikbal5577","false","UgyXYHqMnHla_dGtgJx4AaABAg","Masee starlink bujget brp ya","4843","false","https://www.youtube.com/watch?v=U-ZyepruMh0","4 months ago","0",,"STARLINK INDONESIA REVIEW, INTERNET DARI LANGIT TANPA SINYAL DIMANAPUN ANDA BERADA (TERLENGKAP)","comment","U-ZyepruMh0","0"
"@ringgovengeance7939","false","UgwI0C6BrsPJm_aIVNh4AaABAg","Setia sama indihome bang aq 😅😅","4843","false","https://www.youtube.com/watch?v=U-ZyepruMh0","4 months ago","0",,"STARLINK INDONESIA REVIEW, INTERNET DARI LANGIT TANPA SINYAL DIMANAPUN ANDA BERADA (TERLENGKAP)","comment","U-ZyepruMh0","0"
"@emine1256","false","UgxmAHm1sCDBmhpSHvd4AaABAg","speed uploadnya sama aja","4843","false","https://www.youtube.com/watch?v=U-ZyepruMh0","4 months ago","0",,"STARLINK INDONESIA REVIEW, INTERNET DARI LANGIT TANPA SINYAL DIMANAPUN ANDA BERADA (TERLENGKAP)","comment","U-ZyepruMh0","0"
"@princebire","false","UgwbaU_wkCfCfiyYob54AaABAg","Semakin komptitif buat Telkomsel","4843","false","https://www.youtube.com/watch?v=U-ZyepruMh0","4 months ago","0",,"STARLINK INDONESIA REVIEW, INTERNET DARI LANGIT TANPA SINYAL DIMANAPUN ANDA BERADA (TERLENGKAP)","comment","U-ZyepruMh0","1"
"@TataMiarta","false","UgzRGDda8f8VdVvRr6V4AaABAg.A4B8VqPWVDzA4B8s99JnKz","Bantu jawab dong","4843","false","https://www.youtube.com/watch?v=U-ZyepruMh0","4 months ago","0","UgzRGDda8f8VdVvRr6V4AaABAg","STARLINK INDONESIA REVIEW, INTERNET DARI LANGIT TANPA SINYAL DIMANAPUN ANDA BERADA (TERLENGKAP)","reply","U-ZyepruMh0","0"
"@eliayesaya163","false","UgzeMQpKzjoJbsOaBKJ4AaABAg","Di tembak mode repeater kira2 kencang lah masuk mikrotik","4843","false","https://www.youtube.com/watch?v=U-ZyepruMh0","4 months ago","0",,"STARLINK INDONESIA REVIEW, INTERNET DARI LANGIT TANPA SINYAL DIMANAPUN ANDA BERADA (TERLENGKAP)","comment","U-ZyepruMh0","0"
"@gunawanifnawa3417","false","Ugxu0Rw9BETqAkplbsZ4AaABAg","Ulasannya mantap, karena mengulas sesuatu yang baru. Namun saya masih bertanya-tanya, apa maskud efek asap pada menit pertama  lalu batuk-batuk? 😂....","4843","false","https://www.youtube.com/watch?v=U-ZyepruMh0","4 months ago","0",,"STARLINK INDONESIA REVIEW, INTERNET DARI LANGIT TANPA SINYAL DIMANAPUN ANDA BERADA (TERLENGKAP)","comment","U-ZyepruMh0","0"
"@ramamoksha","false","UgwbdLm68FnLyVK4wCR4AaABAg","Mas, aku punya pertanyaan, klo mau pindah alamat gimana ya mas?","4843","false","https://www.youtube.com/watch?v=U-ZyepruMh0","4 months ago","0",,"STARLINK INDONESIA REVIEW, INTERNET DARI LANGIT TANPA SINYAL DIMANAPUN ANDA BERADA (TERLENGKAP)","comment","U-ZyepruMh0","0"
"@ekonurdiansyah6489","false","UgwR1PuwKrkklMLUS_94AaABAg","Bang untuk biaya paket perbulannya, pembayarannya wajib pakai kartu kredit kah ?","4843","false","https://www.youtube.com/watch?v=U-ZyepruMh0","4 months ago","0",,"STARLINK INDONESIA REVIEW, INTERNET DARI LANGIT TANPA SINYAL DIMANAPUN ANDA BERADA (TERLENGKAP)","comment","U-ZyepruMh0","0"
"@zafran_66","false","UgzBGBZkfgoMfcvcW254AaABAg","Bisa ini di pake di laut? KLO emang pkenya satelit","4843","false","https://www.youtube.com/watch?v=U-ZyepruMh0","4 months ago","0",,"STARLINK INDONESIA REVIEW, INTERNET DARI LANGIT TANPA SINYAL DIMANAPUN ANDA BERADA (TERLENGKAP)","comment","U-ZyepruMh0","0"
"@7_Moment","false","UgyVAsX90yjAoF0foWJ4AaABAg","Bang ini bisa buat jualan vouchernya ngak sama kaya wifi - wifi yg lain... ??","4843","false","https://www.youtube.com/watch?v=U-ZyepruMh0","4 months ago","0",,"STARLINK INDONESIA REVIEW, INTERNET DARI LANGIT TANPA SINYAL DIMANAPUN ANDA BERADA (TERLENGKAP)","comment","U-ZyepruMh0","0"
"@rachmadkecuk9310","false","UgxZBauJibT25EmHP754AaABAg","Bisa di cabang di sebarluaskan g kak","4843","false","https://www.youtube.com/watch?v=U-ZyepruMh0","4 months ago","0",,"STARLINK INDONESIA REVIEW, INTERNET DARI LANGIT TANPA SINYAL DIMANAPUN ANDA BERADA (TERLENGKAP)","comment","U-ZyepruMh0","0"
